"STATUS","CONTAIN","DATE"
"ham","Sy wa ga sampe2 soalnya",2018-02-28 11:43:00
"ham","Mbak tiara sy da di cyber yaa.. di starbuck",2018-02-28 11:43:00
"spam","Km baru saja akses Apps Sehari-hari terpopuler.Nikmati akses YOUTUBE ga habis habis dgn beli pkt Unlimited HANYA di *123# atau myIM3 http://im3.do/m3",2018-02-28 01:52:00
"ham","Trm ksh Anda sdh akses Facebook dgn IndosatOoredoo. Brdasar pngalamn Anda, sberapa puas Anda thdp kualitas akses FB kami? Balas F1 sd F5 (F5= Sgt puas). FREE",2018-02-27 15:21:00
"spam","Mau nongkrong bareng teman di tanggal tua? Ayo tekan *123*510*3# . Dapatkan DISKON & GRATIS Nelp 60 menit. Trf Rp2.200/3hr. Info: 02172784605 SPI15",2018-02-27 12:22:00
"spam","Saksikan Final Coppa Italia 2017/2018 SuperBigMatch babak Semifinal Leg ke-2, Juventus VS Atalanta hanya di GENFLIX. Tekan *123*519*4#. CS: 08041911911  SPI13",2018-02-27 12:05:00
"spam","Km baru saja akses Apps Sehari-hari terpopuler.Nikmati akses YOUTUBE ga habis habis dgn beli pkt Unlimited HANYA di *123# atau myIM3 http://im3.do/m3",2018-02-27 01:30:00
"spam","GRATIS UNLIMITED YOUTUBE+INTERNET 10GB+CHAT&SOSMED+SMS+NELPON selama 30hari.Data Rollover.PROMO 100Rb (Normal 115rb). MAU? Tekan C25 kirim SMS ke 929 sekarang",2018-02-26 19:08:00
"spam","Selamat untuk nomer 085722688068 Kamu masuk PROMO EXTRA SMS, segera hubungi *885*77*24# utk menerima info GOSIP (sms premium) CS: 02145869935",2018-02-26 09:28:00
"spam","Uber: Anda mendapatkan potongan 50% hingga Rp 5000, untuk 10 perjalanan uberMOTOR Anda. Ayo pesan Uber-mu sekarang! http://t.uber.com/nguber",2018-02-26 05:06:00
"spam","Km baru saja akses Apps Sehari-hari terpopuler.Nikmati akses YOUTUBE ga habis habis dgn beli pkt Unlimited HANYA di *123# atau myIM3 http://im3.do/m3",2018-02-26 01:53:00
"spam","Ayo diaktifkan iRing KERENnya, NOAH-Biar Ku Sendiri (HS) Rp.0,1/3hr prpnjngan Rp.3190 hnya dgn balas YA!",2018-02-25 21:11:00
"ham","Sdh sampai bu",2018-02-24 17:46:00
"spam","GRATIS INTERNET 2GB plus UNLIMITED CHAT & SOSMED selama 30hari. DataRollover. PROMO 35Rb (Normal 40rb). MAU? Tekan OK kirim SMS ke 929 sd 26/02/18",2018-02-24 07:51:00
"ham","Dah sampe de",2018-02-23 18:14:00
"ham","Ya",2018-02-23 17:52:00
"ham","Ya",2018-02-23 11:12:00
"spam","Kamu baru menikmati BEBAS SMS ke sesama IM3 Ooredoo. Nikmati Penawaran paket TERBAIK di *123# atau myIM3 http://im3.do/m3",2018-02-23 11:11:00
"ham","De makan kucing buat nati sore hbis",2018-02-23 11:08:00
"spam","Kamu baru menikmati BEBAS SMS ke sesama IM3 Ooredoo. Nikmati Penawaran paket TERBAIK di *123# atau myIM3 http://im3.do/m3",2018-02-22 08:33:00
"ham","De blin makan kucing ya",2018-02-22 07:01:00
"spam","GRATIS UNLIMITED YOUTUBE+INTERNET 10GB+CHAT&SOSMED+SMS+NELPON selama 30hari.Data Rollover.PROMO 100Rb (Normal 115rb). MAU? Tekan C25 kirim SMS ke 929 sekarang",2018-02-22 06:46:00
"spam","Km baru saja akses Apps Sehari-hari terpopuler.Nikmati akses YOUTUBE ga habis habis dgn beli pkt Unlimited HANYA di *123# atau myIM3 http://im3.do/m3",2018-02-22 01:10:00
"spam","Pelanggan 6285722688068, Anda masih mempunyai point yang blom ditukar. Cek point anda dan tukarkan dengan PULSA dan JUTAAN hadiah. Cek di *123*513*1# sekarang.",2018-02-21 22:43:00
"spam","BENAR2 UNLIMITED! YouTube, Chat & Sosmed 24 Jam Gak abis-abis tanpa bayar lebih! Ayo RAJAI INTERNET dengan paket UNLIMITED info http://im3.do/ul0221 MAI1",2018-02-21 14:00:00
"spam","Km baru saja akses Apps Sehari-hari terpopuler.Nikmati akses YOUTUBE ga habis habis dgn beli pkt Unlimited HANYA di *123# atau myIM3 http://im3.do/m3",2018-02-21 01:00:00
"ham","Sesuai aplikasi saja ya mba",2018-02-20 20:43:00
"ham","Maav kak ini dari GRAB",2018-02-20 19:29:00
"spam","LUCKY BRONET 24Jam 8GB cuma Rp50rb di RAWIT besok!!Beli promonya di *123*888# /AXISnet, ada BONUS 1GB stlh pembelian, berlaku di semua Jaringan!Info838.AXIS007",2018-02-20 17:24:00
"spam","AXIS Berbagi DISKON! Bronet 24jam 2GB CUMA 15rb,30hr (Norm 30,900) Balas YA, utk dapetin skrg. Internetan makin eksis krn diskon dr AXIS! Info838 AND01B",2018-02-20 08:46:00
"spam","Pelanggan 6285722688068, Anda masih mempunyai point yang blom di tukar. Cek point anda dan tukarkan dengan PULSA dan JUTAAN hadiah. Cek di *123*518*1# sekarang.",2018-02-20 08:19:00
"spam","Km baru saja akses Apps Sehari-hari terpopuler.Nikmati akses YOUTUBE ga habis habis dgn beli pkt Unlimited HANYA di *123# atau myIM3 http://im3.do/m3",2018-02-20 00:07:00
"spam","Tonton Drama Korea/Tanah Air di iFLIX dg promo BRONET kuota besar hny di RABU RAWIT *123*888# Ada BONUS 1GB stlh beli BRONET mulai 5GB di RAWIT.Info838.AXIS007",2018-02-19 10:12:00
"spam","Tonton Drama Korea/Tanah Air di iFLIX dg promo BRONET kuota besar hny di RABU RAWIT *123*888# Ada BONUS 1GB stlh beli BRONET mulai 5GB di RAWIT.Info838.AXIS007",2018-02-19 08:19:00
"spam","Km baru saja akses Apps Sehari-hari terpopuler.Nikmati akses YOUTUBE ga habis habis dgn beli pkt Unlimited HANYA di *123# atau myIM3 http://im3.do/m3",2018-02-19 01:22:00
"spam","Uber: Anda mendapatkan potongan 50% hingga Rp 15000, untuk 10 perjalanan uberX/XL/POOL/UberBLACK Anda. Ayo pesan Uber-mu sekarang! http://t.uber.com/nguber",2018-02-18 23:16:00
"spam","Hore!Nomor Kamu salah satu yg beruntung dpt kesempatan menang Rp 75 Juta TANPA BIAYA dr FANTAXIS!

Cek di *123*444*1# skr!

Info: www.axisnet.id/fantaxis PFF04D",2018-02-18 15:48:00
"spam","Pelanggan Yth,untuk peningkatan kualitas layanan,akan dilakukan penataan frekuensi di Area Anda dalam 7 hari ke depan.Mhn maaf atas ketidaknyamanannya.Info:817",2018-02-18 12:20:00
"spam","GRATIS UNLIMITED YOUTUBE+INTERNET 10GB+CHAT&SOSMED+SMS+NELPON selama 30hari.Data Rollover.PROMO 100Rb (Normal 115rb). MAU? Tekan C25 kirim SMS ke 929 sekarang",2018-02-17 15:04:00
"spam","The terminal cannot be configured remotely, please contact Customer support for further assistance",2018-02-17 14:54:00
"spam","Km baru saja akses Apps Sehari-hari terpopuler.Nikmati akses YOUTUBE ga habis habis dgn beli pkt Unlimited HANYA di *123# atau myIM3 http://im3.do/m3",2018-02-17 14:47:00
"ham","Nikmati akses ke FB, Path, Twitter,Whatsapp, BBM, Line,FB Msg, iFlix&Spotify gak habis habis kuotanya. Info *123# atau myIM3 http://im3.do/m3",2018-02-17 14:45:00
"ham","Kamu skrg aktif di Unlimited+3GB sd 19/03/2018 14:45.Nikmati akses UNLIMITED Apps,SMS&akses YTUBE gak habis habis.Cek kuota*123# atau http://im3.do/m3",2018-02-17 14:45:00
"ham","Registrasi paket Anda sedang diproses. Pastikan settingan APN : indosatgprs. User, passwd & proxy dikosongkan. Restart HP Anda setelah registrasi berhasil.",2018-02-17 14:45:00
"spam","?PromoNotif",2018-02-17 14:22:00
"spam","TOPUP pulsa Rp 50000 berhasil via SMSBANKING CIMB_NIAGA kode trx 0217142209020241. Pulsa anda saat ini Rp 50020. Terima kasih telah menggunakan INDOSAT OOREDOO",2018-02-17 14:22:00
"spam","TOPUP pulsa Rp 50000 berhasil via SMSBANKING CIMB_NIAGA kode trx 0217142209020241. Pulsa anda saat ini Rp 50020. Terima kasih telah menggunakan INDOSAT OOREDOO",2018-02-17 14:22:00
"spam","(AXIS) Kuota 4G paket internet kamu telah digunakan seluruhnya. Penggunaan selanjutnya akan dikenakan tarif normal ya. Info838",2018-02-17 12:11:00
"spam","Untuk mengindari PEMBLOKIRAN, Pemerintah mewajibkan SEGERA REGISTRASI ULANG kartu Anda. Ketik: ULANG#NIK#No.KK# kirim SMS ke4444, klik: http://im3.do/registrasi",2018-02-16 21:41:00
"spam","Perpanjangan PAKET BRONET 24JAM 3GB 30hr Rp40900 tidak berhasil.Pulsa kartu AXISmu tidak cukup utk perpanjangan otomatis. Silakan Isi ulang kembali ya.Info838",2018-02-16 00:31:00
"spam","Pelanggan 6285722688068, Anda masih mempunyai point yang blom di tukar. Cek point anda dan tukarkan dengan PULSA dan JUTAAN hadiah. Cek di *654*9# sekarang.",2018-02-15 21:01:00
"spam","Hore! Nomor Kamu terpilih dpt kesempatan menang Rp 75 Juta TANPA BIAYA dr kuis FANTAXIS!

Cek di *123*444*1# skr!

Info: www.axisnet.id/fantaxis PFF04C",2018-02-15 18:02:00
"spam","iRing keren cuman buat km, Papinka-Cinta Dan Luka (Reff),Rp.0,1/3hr prpnjngan Rp.3190 dengan hnya bls YA lho!",2018-02-15 08:26:00
"spam","Paket kamu akan diperpanjang otomatis HARI INI ke PAKET BRONET 24JAM 3GB 30hr Rp40900. Pastikan pulsa kamu min45rb ya. Info838",2018-02-15 07:34:00
"spam","Pelanggan 6285722688068, Anda masih mempunyai point yang blom ditukar. Cek point anda dan tukarkan dengan PULSA dan JUTAAN hadiah. Cek di *654*9# sekarang.",2018-02-15 01:05:00
"spam","Terus nikmati paket internet terbaik AXIS! Pastikan pulsa kamu min45rb ya untuk perpanjangan paket otomatis 2 hari lagi. Info838 ",2018-02-14 19:01:00
"spam","Tinggal 5jam lagi! 
AXIS Bronet 24jam 2GB CUMA 15rb,30hr (Norm 30,900). Dapetin skrg juga dgn Balas YA! Internetan ASYIK tetep IRIT.
Info838 AND01B",2018-02-14 16:41:00
"spam","BRONET 24Jam 5GB hny Rp45.900 di RAWIT hari ini!! Mau? Beli promonya di *123*888# /AXISnet, BONUS 1GB stlh pembelian, berlaku di semua Jaringan!Info838.AXIS007",2018-02-14 14:03:00
"spam","BRONET 24Jam 5GB hny Rp45.900 di RAWIT hari ini!! Mau? Beli promonya di *123*888# /AXISnet, BONUS 1GB stlh pembelian, berlaku di semua Jaringan!Info838.AXIS007",2018-02-14 11:26:00
"spam","*Masih DISKON*
AXIS Bronet 24jam 2GB CUMA 15rb,30hr (Norm 30,900). Dapetin skrg juga dgn Balas YA! Internetan ASYIK tetep IRIT. AXIS 4G Ready
Info838 AND01B",2018-02-14 09:04:00
"spam","Ayo diaktifkan iRing KERENnya, Nikita Willy-Blowed Rp.0,1/3hr prpnjngan Rp.3190 hnya dgn balas YA!",2018-02-14 07:04:00
"spam","Pelanggan 6285722688068, Anda masih mempunyai point yang blom ditukar. Cek point anda dan tukarkan dengan PULSA dan JUTAAN hadiah. Cek di *654*9# sekarang.",2018-02-14 06:45:00
"spam","GRATIS UNLIMITED YOUTUBE PLUS INTERNET 7GB + CHAT & SOSMED + SMS selama 30hari. Data Rollover. PROMO 70Rb (Normal 80rb). MAU? Tekan C24 kirim SMS ke 929 sd 15/02/18",2018-02-13 10:33:00
"spam","AXIS Berbagi DISKON! Bronet 24jam 2GB CUMA 15rb,30hr (Norm 30,900) Balas YA, utk dapetin skrg. Internetan makin eksis krn diskon dr AXIS! Info838 AND01B",2018-02-13 10:31:00
"spam","awas ketinggalan iRing Aldy Maldini-Biar Aku Yang Pergi, Rp.0,1/3hr prpnjngan Rp.3190 .Lngsung bls YA aja ya!",2018-02-13 09:00:00
"spam","Pelanggan 6285722688068, Anda masih mempunyai point yang blom di tukar. Cek point anda dan tukarkan dengan PULSA dan JUTAAN hadiah. Cek di *757*15# sekarang.",2018-02-13 01:32:00
"spam","maaf baru saya kabarin,kalau kontraknya masih mau diteruskan bayar sama H.edi,no hpnya.081527744899.soalnya sudah sya jual atau pindah tangan ke beliau.",2018-02-13 01:32:00
"spam","Anda susah tidur? hubungi langsung  Dokter Ahli untuk konsultasi. Tekan *123*516*6# di ponsel anda  atau klik bit.ly/im3mH SPI1",2018-02-12 11:15:00
"spam","PAKET BRONET 4G OWSEM 4GB 30hr kamu akan segera aktif. Temukan PROMO menarik AXIS lainnya di aplikasi AXISnet kamu. Info838",2018-02-12 09:22:00
"spam","PAKET BRONET 4G OWSEM 4GB sudah aktif. 1GB kuota utama+3GB kuota 4G berlaku di jam 00-23.59 s.d 13-03-2018.Info838",2018-02-12 09:21:00
"spam","Isi ulang Rp50000.0 berhasil. Kode transaksi 66310212719258. Yuk registrasi ulang kartu AXIS kamu! Kirim SMS ke 4444 dgn format : ULANG#NIK#No.KK",2018-02-12 09:15:00
"spam","(AXIS) Kuota 4G paket internet kamu telah digunakan seluruhnya. Penggunaan selanjutnya akan dikenakan tarif normal ya. Info838",2018-02-11 22:16:00
"spam","Tinggal 5jam lagi! 
AXIS Bronet 24jam 2GB CUMA 15rb,30hr (Norm 30,900). Dapetin skrg juga dgn Balas YA! Internetan ASYIK tetep IRIT.
Info838 AND01B",2018-02-11 17:04:00
"ham","(CITITRANS)CT: Pesanan anda tujuan Dipati Ukur-Fatmawati pd 2018-02-11 12:45:00 dgn no kursi 1 tercatat dgn kode booking BOAP18021479601",2018-02-11 09:11:00
"ham","Untuk mengindari PEMBLOKIRAN, Pemerintah mewajibkan SEGERA REGISTRASI ULANG kartu Anda. Ketik: ULANG#NIK#No.KK# kirim SMS ke4444, klik: http://im3.do/registrasi",2018-02-10 13:54:00
"spam","AXIS Berbagi DISKON! Bronet 24jam 2GB CUMA 15rb,30hr (Norm 30,900) Balas YA, utk dapetin skrg. Internetan makin eksis krn diskon dr AXIS! Info838 AND01B",2018-02-10 11:56:00
"spam","iRing keren cuman buat km, Papinka-Cinta Dan Luka (Reff),Rp.0,1/3hr prpnjngan Rp.3190 dengan hnya bls YA lho!",2018-02-10 08:25:00
"spam","Pelanggan 6285722688068, Anda masih mempunyai point yang blom ditukar. Cek point anda dan tukarkan dengan PULSA dan JUTAAN hadiah. Cek di *654*9# sekarang.",2018-02-10 07:09:00
"ham","Ok tmksh",2018-02-09 19:27:00
"spam","BRONET 24Jam 3GB hny Rp29.900 (normal Rp39.900) bisa buat nonton IFLIX dg beli di *123*888# /AXISNET. Yuk, beli paketnya spy WEEKND-mu SERU..!! Info838.AXIS007",2018-02-09 11:50:00
"spam","BENAR2 UNLIMITED! YouTube, Sosmed & Streaming 24 Jam Gak abis-abis tanpa bayar lebih! Ayo RAJAI INTERNET dengan paket UNLIMITED info http://im3.do/ul0209 MAI1",2018-02-09 08:59:00
"spam","Ayo diaktifkan iRing KERENnya, Nikita Willy-Blowed Rp.0,1/3hr prpnjngan Rp.3190 hnya dgn balas YA!",2018-02-09 07:51:00
"ham","De makan kucing buat nati sore uadh gak ada ",2018-02-09 06:23:00
"spam","(AXIS) Kuota 4G paket internet kamu  hanya 20% lagi. Cek detail pemakaian kamu di aplikasi AXISnet atau telp *889#. Info838",2018-02-09 04:31:00
"spam","Pelanggan 6285722688068, Anda masih mempunyai point yang blom di tukar. Cek point anda dan tukarkan dengan PULSA dan JUTAAN hadiah. Cek di *757*15# sekarang.",2018-02-08 23:27:00
"spam","Ciee yg dpt kesempatan menang Rp 75 Juta TANPA BIAYA dr AXIS! SELAMAT ya Km bs ikutan FANTAXIS!

Cek di *123*444*1# skrg!

Info: www.axisnet.id/fantaxis PFF02B",2018-02-08 15:15:00
"ham","De makan kucng mau  belii kapan ?",2018-02-08 14:50:00
"spam","Ayo pakai MHealth, kamu bisa konsultasi kesehatan langsung dgn Dokter Ahli setiap hari. Tekan *123*516#. Info: 085810533965 atau klik bit.ly/im3mH SPI1",2018-02-08 11:43:00
"ham","oke",2018-02-08 08:56:00
"spam","awas ketinggalan iRing Aldy Maldini-Biar Aku Yang Pergi, Rp.0,1/3hr prpnjngan Rp.3190 .Lngsung bls YA aja ya!",2018-02-08 08:32:00
"spam","Pelanggan 6285722688068, Anda masih mempunyai point yang blom ditukar. Cek point anda dan tukarkan dengan PULSA dan JUTAAN hadiah. Cek di *757*15# sekarang.",2018-02-08 07:39:00
"ham","IYa",2018-02-07 19:41:00
"ham","Masi  ada  untu 2 hari lagi",2018-02-07 18:48:00
"ham","De besok bliin makan kucing ya ",2018-02-07 18:46:00
"spam","Hapus kekhawatiran kamu dengan tausiyah manajemen hati dari Aa Gym. Tekan *123*503*7#. Tarif Rp2.200/SMS, 3SMS/minggu. Info: 0213145715 bit.ly/QUTAaG  SPI8",2018-02-07 12:21:00
"spam","Nonton film favorit di IFLIX,bebas biaya langganan utk AXISers!!Pake BRONET 24Jam 2GB Rp24.900 buat nonton,beli di *123*888# hny di RABU RAWIT.Info838.AXIS007",2018-02-07 10:08:00
"spam","Pelanggan 6285722688068, Anda masih mempunyai point yang blom ditukar. Cek point anda dan tukarkan dengan PULSA dan JUTAAN hadiah. Cek di *757*16# sekarang.",2018-02-07 03:11:00
"spam","Hai AXISers, knp ga pakai paket data bulanan aja? Yok cobain paket terbaru yg bikin lebih hemat, Bronet OWSEM 4G! Cek *123*2# atau aktifin di Axisnet! ARN01A",2018-02-07 01:14:00
"spam","Mau dapat rezeki yang berkah cara Aa Gym? Tekan *123*503*7#. Tarif Rp2.200/SMS, 3SMS/minggu. Info: 0213145715 bit.ly/QUTAaG SPI9",2018-02-06 16:25:00
"ham","Bntr ya mba ngambil dulu uang ke atm...bntar ko uangnya krng buat belinya...makasih",2018-02-06 15:35:00
"spam","RABU RAWIT besok ada BRONET 24Jam 2GB 30hr Rp24.900 bisa buat nonton IFLIX dg beli di *123*888# /app AXISNET!! Siapin pulsanya ya AXISers... !! Info838.AXIS007",2018-02-06 13:20:00
"spam","Pelanggan 6285722688068, Anda masih mempunyai point yang blom di tukar. Cek point anda dan tukarkan dengan PULSA dan JUTAAN hadiah. Cek di *123*513*1# sekarang.",2018-02-06 07:30:00
"ham","Bu tempatnya kga ketemu saya cari saya cencel aja ya ",2018-02-05 18:16:00
"spam","a. Info 185",2018-02-05 14:13:00
"spam","Pelanggan Yth, utk peningkatan kualitas layanan, akan 
 dilakukan penataan frekuensi di area anda dalam 3 hari 
 kedepan. Mhn maaf atas ketidaknyamananny",2018-02-05 14:01:00
"spam","Trm ksh telah memilih Indosat Ooredoo. Secara keseluruhan, seberapa mungkin Anda merekomendasikan kami ke rekan/klrg? Balas N0 sd N10 (N10=tertinggi), GRATIS",2018-02-05 10:22:00
"spam","awas ketinggalan iRing Angga Yunanda-Disini Untuk Kamu, Rp.0,1/3hr prpnjngan Rp.3190 .Lngsung bls YA aja ya!",2018-02-05 07:09:00
"ham","Terima kasih Tn/Ny Tiara atas pembayaran E2PAYDTR780A1ECTTX sebesar Rp.112.000.OTP (checkin loket): 317602.Cek email utk tiket elektroniknya.",2018-02-04 12:08:00
"ham","Hi Tiara, Surprise! km terpilih dpt VOUCHER Rp. 200.000, tunjukan sms ini di Original Levi's Store terdekat. T&C Apply http://bit.ly/2nws13W",2018-02-04 10:11:00
"spam","Raih Uang Tunai Total 168JUTA buat Top 100 poin tertinggi setiap minggunya!Buruan KEPOin programnya di *123*565*6#.  (Coba Gratis2hr)Info838. AV803",2018-02-03 13:35:00
"spam","Pelanggan 6285722688068, Anda masih mempunyai point yang blom ditukar. Cek point anda dan tukarkan dengan PULSA dan JUTAAN hadiah. Cek di *123*513*2# skrg juga.",2018-02-03 02:21:00
"spam","Hai sahabat IM3 Ooredoo, apakah Anda tahu tentang PAYPRO, layanan untuk pembayaran elektronik? Balas ketik YA4 jika tahu atau TDK4 jika tdk tahu. GRATIS",2018-02-02 20:05:00
"spam","BRONET DAYZ 17GB Rp89.900 hny di JUMAT BAIK dg akses *123*888# /app AXISnet dr HP, dapet BONUS 1GB setelah pembelian, berlaku di semua jaringan.Info838.AXIS007",2018-02-02 11:25:00
"spam","Bonus IM3PUAS : Kamu dpt GRATIS 1000 SMS ke Indosat dan 20 SMS ke operator lain berlaku sekarang s.d jam 23.59. Cek bonus *555*12#",2018-02-02 10:03:00
"spam","Pulsamu <Rp2500.Mau PULSA SOS 10000 bs dipakai ke SemuaOperator sd 5hr?Pembayaran Rp10000 & BeaJasa Rp3000 akan dipotong saat isi Pulsa.Balas YA ke 505 /tkn*505#",2018-02-02 10:03:00
"spam","Internetan nyaman selama perjalanan ke luar negeri dgn Paket Roaming dr IM3 Ooredoo, mulai Rp35rb/hari. Tekan *122*1#. Info: http://im3ooredoo.com/roaming PAI1",2018-02-02 09:48:00
"spam","PAKET BRONET 4G OWSEM 4GB sudah aktif. 1GB kuota utama+3GB kuota 4G berlaku di jam 00-23.59 s.d 03-03-2018.Info838",2018-02-02 08:16:00
"spam","PAKET BRONET 4G OWSEM 4GB 30hr kamu akan segera aktif. Temukan PROMO menarik AXIS lainnya di aplikasi AXISnet kamu. Info838",2018-02-02 08:16:00
"spam","Isi ulang Rp50000.0 berhasil. Kode transaksi 55310202518712. Yuk registrasi ulang kartu AXIS kamu! Kirim SMS ke 4444 dgn format : ULANG#NIK#No.KK",2018-02-02 08:16:00
"ham","BNI SMS BANKING:02/02/2018 08:14 Topup XL ke nomor 08382888813 sebesar Rp. 50.000 berhasil. Reff: 20738919.",2018-02-02 08:14:00
"ham","02/02/2018 08:13 TOP XL No 08382888813 sebesar Rp 50000.Utk diproses,reply sms ini,ketik digit ke-5&2 PIN Anda",2018-02-02 08:13:00
"spam","(AXIS) Kamu sdg internetan tanpa paket internet. Pulsa kamu saat ini 513. Lebih IRIT dgn aktifkan paket Internet AXIS, telp *123*887# sekarang! Info838",2018-02-02 08:11:00
"spam","Plgn 6285722688068, poin mu MASIH belum diambil juga? Hub *123*520*15# utk Ambil. Bisa buat tuker pulsa. Jangan sampai hangus.",2018-02-01 20:39:00
"ham","01/02/2018 12:27:16 Ref 0201026669 Passcode 5353 untuk LOGIN Go Mobile CIMB Niaga. Passcode bersifat RAHASIA. Jangan beri ke siapapun!",2018-02-01 12:27:00
"spam","BENAR2 UNLIMITED! YouTube, Sosmed & Streaming 24 Jam Gak abis-abis tanpa bayar lebih! Ayo RAJAI INTERNET dengan paket UNLIMITED info http://im3.do/ul0201 MAI1",2018-02-01 11:06:00
"spam","Pelanggan 6285722688068, Anda masih mempunyai point yang blom di tukar. Cek point anda dan tukarkan dengan PULSA dan JUTAAN hadiah. Cek di *757*16# skrg juga.",2018-01-31 21:56:00
"spam","Harga baru BRONET 24Jam 8GB hny Rp59.900 di RAWIT dg akses *123*888# /app AXISnet dr HP. BONUS 1GB setelah pembelian, berlaku di semua jaringan.Info838.AXIS007",2018-01-31 13:11:00
"ham","31/01/2018 10:56 Pada No. Rek 378088918 ada dana keluar sebesar Rp 100.000,00. Saldo akhir: Rp 3.348.689,00.Berita: BILL PAYMENT  GOPAY CUST    NO  271517370600",2018-01-31 10:56:00
"ham","BNI SMS BANKING:31/01/2018 10:50 TOP GOPAY CUSTOMER 085722688068 Nama:tiara Rp.100.000 Berhasil. Reff:479373",2018-01-31 10:50:00
"ham","31/01/2018 10:50 TOP GOPAY CUSTOMER 085722688068 Nama:tiara Rp.100.000 ketik digit ke-1&2 PIN Anda",2018-01-31 10:50:00
"ham","Cashback up to IDR 500.000,- + 0% until 24 months for Samsung Smartphone with Credit Card at Samsung Outlets, 19 Jan -04 Feb'18. T&C. Info 14041",2018-01-31 09:31:00
"spam","Hi 6285722688068, kamu beruntung mendapatkan kesempatan GRATIS PULSA INDOSAT, cek di *689*15#",2018-01-30 19:42:00
"ham","Disc upto 30% +Add Disc 200K for Samsung Smartphone +0% upto 24mos. Until 31Jan18. Register w/CIMBNiaga email at shop.samsung .com/id_epp/cimbniaga.TC Info14041",2018-01-30 13:00:00
"spam","Pelanggan 6285722688068, Anda masih mempunyai point yang blom ditukar. Cek point anda dan tukarkan dengan PULSA dan JUTAAN hadiah. Cek di *757*15# skrg juga.",2018-01-30 03:26:00
"ham","29/01/2018 21:05 Pada No. Rek 378088918 ada dana keluar sebesar Rp 3.000.000,00. Saldo akhir: Rp 3.448.689,00.Berita: TRF PAY TOP UP ECHANNEL.",2018-01-29 21:05:00
"ham","BNI SMS BANKING:29/01/2018 21:03 Trf Rp 3000000 ke CIMB NIAGA 0030167998115/SUMINAR BUDIARANI ## telah berhasil Ref:976981-100000995793",2018-01-29 21:03:00
"ham","29/01/2018 21:03 Trf Rp3000000 ke CIMB NIAGA 0030167998115/SUMINAR BUDI ## Utk diproses,reply sms ini,ketik digit ke-4&1 PIN Anda",2018-01-29 21:03:00
"spam","Pelanggan 6285722688068, Anda masih mempunyai point yang blom ditukar. Cek point anda dan tukarkan dengan PULSA dan JUTAAN hadiah. Cek di *757*15# skrg juga.",2018-01-29 20:56:00
"ham","Untuk mengindari PEMBLOKIRAN, Pemerintah mewajibkan SEGERA REGISTRASI ULANG kartu Anda. Ketik: ULANG#NIK#No.KK# kirim SMS ke4444, klik: http://im3.do/registrasi",2018-01-29 11:30:00
"ham","29/01/2018 08:57 Pada No. Rek 378088918 ada dana keluar sebesar Rp 100.000,00. Saldo akhir: Rp 955.189,00.Berita: BILL PAYMENT  GOPAY CUST    NO  10151719080478",2018-01-29 08:57:00
"ham","BNI SMS BANKING:29/01/2018 08:53 TOP GOPAY CUSTOMER 085722688068 Nama:tiara Rp.100.000 Berhasil. Reff:309944",2018-01-29 08:53:00
"ham","29/01/2018 08:53 TOP GOPAY CUSTOMER 085722688068 Nama:tiara Rp.100.000 ketik digit ke-1&5 PIN Anda",2018-01-29 08:53:00
"spam","Yuk main games seru sepuasnya di GALAXIS! Ada hadiah kuota 5GB utk 10org tiap minggunya. Buruan main di *123*988*88# Info838 AV825",2018-01-28 13:10:00
"ham","27/01/2018 16:57 Pada No. Rek 378088918 ada dana keluar sebesar Rp 526.680,00. Saldo akhir: Rp 1.055.189,00.Berita: TRF PAY TOP UP ECHANNEL.",2018-01-27 16:57:00
"spam","MOBOINDOSAT
sampaikan bahwa
No.anda pemenang
cek tunai Rp.100 jt
kode PIN undian
25e477r INFO
hadiah buka/KLIK:
www.layananmoboindosat2018.blogspot.com





",2018-01-27 10:12:00
"ham","Disc upto 30% +Add Disc 200K for Samsung Smartphone +0% upto 24mos. Until 31Jan18. Register w/CIMBNiaga email at shop.samsung .com/id_epp/cimbniaga.TC Info14041",2018-01-27 10:01:00
"spam","Pelanggan 6285722688068, Anda masih mempunyai point yang blom di tukar. Cek point anda dan tukarkan dengan PULSA dan JUTAAN hadiah. Cek di *654*9# skrg juga!",2018-01-26 23:17:00
"ham","26/01/2018 22:19 Pada No. Rek 378088918 ada dana keluar sebesar Rp 683.485,00. Saldo akhir: Rp 1.581.869,00.Berita: TRF PAY TOP UP ECHANNEL.",2018-01-26 22:19:00
"spam","AXISers, cobain pkt 4G OWSEM mulai Rp30.900 kuota 4GB dg akses *123*888# / AXISnet dr HP. Ada juga Juara AXIS pkt BRONET DAYZ 8GB hny Rp49.000 Info838. AXIS007",2018-01-26 15:11:00
"ham","Bonus paket sembako senilai 150rb min trx 1jt dg Kartu Kredit CIMB Niaga di Lotte Mart & Lotte Supermarket, berlaku setiap hari dari 26-31Jan'18.S&K.Info 14041",2018-01-26 10:49:00
"spam","Ayo diaktifkan iRing KERENnya, Hiroaki Kato feat. Noe Letto-Ruang Rindu Rp.0,1/3hr prpnjngan Rp.3190 hnya dgn balas YA!",2018-01-26 08:46:00
"spam","Paket Freedom XXL 30 hari Rp199rb dgn kuota 12GB + 25GB (4G) + nelpon sepuasnya ke sesama Indosat Ooredoo. Ketik C1 ke 929 sd28/01/18",2018-01-26 06:55:00
"spam","Ayo update lagu-lagu MP3 kamu di tahun baru ini, klik bit.ly/IM3Arena SPI1",2018-01-25 13:23:00
"ham","25/01/2018 08:53 Pada No. Rek 378088918 ada dana keluar sebesar Rp 100.000,00. Saldo akhir: Rp 2.136.354,00.Berita: BILL PAYMENT  GOPAY CUST    NO  121516844925",2018-01-25 08:54:00
"ham","BNI SMS BANKING:25/01/2018 08:49 TOP GOPAY CUSTOMER 085722688068 Nama:tiara Rp.100.000 Berhasil. Reff:593930",2018-01-25 08:49:00
"ham","25/01/2018 08:48 TOP GOPAY CUSTOMER 085722688068 Nama:tiara Rp.100.000 ketik digit ke-1&5 PIN Anda",2018-01-25 08:48:00
"spam","Ayo diaktifkan iRing KERENnya, Via Vallen-Sakit Sakit Hatiku (Reff) Rp.0,1/3hr prpnjngan Rp.3190 hnya dgn balas YA!",2018-01-25 07:33:00
"spam","BARU! OBROL Sepuasnya 24 Jam ke sesama IM3 Ooredoo. Ayo daftar paketnya di *123*999# atau di MyIM3",2018-01-24 19:02:00
"spam","Isi Voucher Regular 25K pd 24/01/18 19:02 dr GO-JEK SUKSES. TID:01119500004241618765",2018-01-24 19:02:00
"ham","Disc upto 30% +Add Disc 200K for Samsung Smartphone +0% upto 24mos. Until 31Jan18. Register w/CIMBNiaga email at shop.samsung .com/id_epp/cimbniaga.TC Info14041",2018-01-24 16:20:00
"spam","Harga baru BRONET 24Jam 8GB hny Rp59.900 di RAWIT dg akses *123*888# /app AXISnet dr HP. BONUS 1GB setelah pembelian, berlaku di semua jaringan.Info838.AXIS007",2018-01-24 15:41:00
"spam","Harga baru BRONET 24Jam 8GB hny Rp59.900 di RAWIT dg akses *123*888# /app AXISnet dr HP. BONUS 1GB setelah pembelian, berlaku di semua jaringan.Info838.AXIS007",2018-01-24 10:31:00
"spam","awas ketinggalan iRing HIVI!-Mata ke Hati (Acoustic Version), Rp.0,1/3hr prpnjngan Rp.3190 .Lngsung bls YA aja ya!",2018-01-24 08:32:00
"spam","Hi 6285722688068, kamu beruntung mendapatkan kesempatan GRATIS PULSA INDOSAT, cek di *689*15#",2018-01-23 19:03:00
"spam","BARU! KUOTA UTAMA BESAR & UNLIMITED BONUS gak habis-habis utk YouTube, SosMed, & Streaming 24Jam tanpa bayar lebih dr IM3Ooredoo.Info http://im3.do/ul0123 MAI1",2018-01-23 12:47:00
"ham","(CITITRANS)CT: Pesanan anda tujuan Fatmawati-Dipati Ukur pd 2018-01-28 06:15:00 dgn no kursi 3 tercatat dgn kode booking BOAP18012420260",2018-01-22 19:10:00
"spam","Trm ksh telah memilih Indosat Ooredoo. Secara keseluruhan, seberapa mungkin Anda merekomendasikan kami ke rekan/klrg? Balas N0 sd N10 (N10=tertinggi), GRATIS",2018-01-22 12:22:00
"ham","(CITITRANS)CT: Pesanan anda tujuan Dipati Ukur-Fatmawati pd 2018-01-28 21:15:00 dgn no kursi 1 tercatat dgn kode booking BOAP18012418142",2018-01-22 07:47:00
"ham","Yuk,bljr Bhs Inggris dgn M-Learning bareng AXIS!

Kamu berkesempatan menang Rp25jt!

Krm MULAI ke 92340
GRATIS 3 hr pertama, selanjutnya: Rp1500/hr PF016D",2018-01-21 14:33:00
"spam","Ayo diaktifkan iRing KERENnya, Hiroaki Kato feat. Noe Letto-Ruang Rindu Rp.0,1/3hr prpnjngan Rp.3190 hnya dgn balas YA!",2018-01-21 08:44:00
"spam","Nonton film favorit di IFLIX,bebas biaya langganan utk AXISers!!Pake BRONET DAYZ 17GB Rp89.000 buat nonton,beli di *123*888# hny di WEEKND SERU.Info838.AXIS007",2018-01-21 08:27:00
"ham","Diskon 5% + Tambahan Diskon Rp300ribu + 0% sd 12 bln utk Lemari Es,Mesin Cuci & AC.Dgn Kartu Kredit di Outlet Electronic Solution. Sd 21 Jan'18. S&K. Info 14041",2018-01-20 10:19:00
"ham","Pesan gojek buat go shop royal cannin ya teh? ",2018-01-19 12:29:00
"spam","Pulsamu <Rp2500.Mau PULSA SOS 10000 bs dipakai ke SemuaOperator sd 5hr?Pembayaran Rp10000 & BeaJasa Rp3000 akan dipotong saat isi Pulsa.Balas YA ke 505 /tkn*505#",2018-01-19 12:21:00
"spam","Bonus IM3PUAS : Kamu dpt GRATIS 1000 SMS ke Indosat dan 50 SMS ke operator lain berlaku sekarang s.d jam 23.59. Cek bonus *555*12#",2018-01-19 12:21:00
"ham","19/01/2018 12:17 Pada No. Rek 378088918 ada dana keluar sebesar Rp 100.000,00. Saldo akhir: Rp 2.668.354,00.Berita: BILL PAYMENT  GOPAY CUST    NO  691516338821",2018-01-19 12:18:00
"ham","BNI SMS BANKING:19/01/2018 12:14 TOP GOPAY CUSTOMER 085722688068 Nama:tiara Rp.100.000 Berhasil. Reff:315932",2018-01-19 12:14:00
"ham","19/01/2018 12:13 TOP GOPAY CUSTOMER 085722688068 Nama:tiara Rp.100.000 ketik digit ke-2&1 PIN Anda",2018-01-19 12:13:00
"spam","Selamat! Ada pulsa 100rb dari RBT Dia! Info: 838 Cek aja di *123*147*2#",2018-01-19 11:59:00
"ham","19/01/2018 11:37 Pada No. Rek 378088918 ada dana keluar sebesar Rp 100.000,00. Saldo akhir: Rp 2.768.354,00.Berita: TARIK TUNAI.",2018-01-19 11:38:00
"ham","Untuk mengindari PEMBLOKIRAN, Pemerintah mewajibkan SEGERA REGISTRASI ULANG kartu Anda. Ketik: ULANG#NIK#No.KK# kirim SMS ke4444, klik: http://im3.do/registrasi",2018-01-19 11:18:00
"spam","Nonton film favorit di IFLIX, bebas biaya langganan utk AXISers!!Pake BRONET DAYZ 8GB Rp49.000 buat nonton, beli di *123*888# hny di JUMAT BAIK.Info838.AXIS007",2018-01-19 09:26:00
"spam","Nonton film favorit di IFLIX, bebas biaya langganan utk AXISers!!Pake BRONET DAYZ 8GB Rp49.000 buat nonton, beli di *123*888# hny di JUMAT BAIK.Info838.AXIS007",2018-01-19 08:52:00
"ham","18/01/2018 11:29 Pada No. Rek 378088918 ada dana keluar sebesar Rp 150.000,00. Saldo akhir: Rp 2.958.354,00.Berita: TARIK TUNAI.",2018-01-18 11:29:00
"ham","Untuk mengindari PEMBLOKIRAN, Pemerintah mewajibkan SEGERA REGISTRASI ULANG kartu Anda. Ketik: ULANG#NIK#No.KK# kirim SMS ke4444, klik: http://im3.do/registrasi",2018-01-18 07:40:00
"spam","PAKET BRONET 24JAM 3GB sudah aktif. Nikmati kuota 3GB berlaku di 00.00-23.59 aktif s.d 15-02-2018.Temukan PROMO menarik AXIS di aplikasi AXISnet! Info838",2018-01-17 10:38:00
"spam","PAKET BRONET 24JAM 3GB 30hr kamu akan segera aktif. Temukan PROMO menarik AXIS di aplikasi AXISnet. Sekarang AXIS sudah 4G Ready lho! Info838",2018-01-17 10:37:00
"spam","Isi ulang Rp50000.0 berhasil. Kode transaksi 55310117669467. Yuk registrasi ulang kartu AXIS kamu! Kirim SMS ke 4444 dgn format : ULANG#NIK#No.KK",2018-01-17 10:37:00
"ham","BNI SMS BANKING:17/01/2018 10:36 Topup XL ke nomor 08382888813 sebesar Rp. 50.000 berhasil. Reff: 15287338.",2018-01-17 10:36:00
"ham","17/01/2018 10:35 TOP XL No 08382888813 sebesar Rp 50000.Utk diproses,reply sms ini,ketik digit ke-4&5 PIN Anda",2018-01-17 10:35:00
"ham","Pulsa Anda tdk mencukupi u/ menerima layanan  dr shortcode 3346 sebesar Rp./sms. Silahkan Isi ulang.
",2018-01-17 10:35:00
"ham","17/01/2018 10:34 Pada No. Rek 378088918 ada dana keluar sebesar Rp 100.000,00. Saldo akhir: Rp 3.158.354,00.Berita: BILL PAYMENT  PENDING EPRS  NO  754613000703",2018-01-17 10:35:00
"ham","BNI SMS BANKING:17/01/2018 10:34 Maaf, perintah yang Anda ketikkan salah atau pengiriman topup ke provider belum tersedia.",2018-01-17 10:34:00
"ham","17/01/2018 10:34 TOP no 08382888813 sebesar Rp 50000.Utk diproses,reply sms ini,ketik digit ke-1&4 PIN Anda",2018-01-17 10:34:00
"spam","Pelanggan Yth, Pulsa Anda tdk mencukupi. Tersedia PULSA SIAGA utk Anda, pembyran dilakukan saat isi pulsa, hub *911# atau bls SMS ini ktk 0",2018-01-17 10:10:00
"spam","(AXIS) Kuota paket data kamu di SENIN-JUMAT telah digunakan seluruhnya. Penggunaan selanjutnya akan dikenakan tarif normal. Info838",2018-01-17 08:12:00
"spam","(AXIS) Kamu sdg internetan tanpa paket internet. Pulsa kamu saat ini 78. Lebih IRIT dgn aktifkan paket Internet AXIS, telp *123*887# sekarang! Info838",2018-01-17 08:12:00
"spam","BARU! KUOTA UTAMA BESAR & UNLIMITED BONUS gak habis-habis utk YouTube, SosMed, & Streaming 24Jam tanpa bayar lebih dr IM3Ooredoo.Info http://im3.do/ul0116 MAI1",2018-01-16 13:05:00
"spam","Terima kasih Anda sdh menelpon dgn IndosatOoredoo. Berdasar pngalamn Anda, seberapa puas Anda thdp kualitas telepon kami? Balas T1 sd T5 (T5= Sgt puas). FREE",2018-01-16 09:56:00
"spam","Film FLASH, CEK TOKO SEBELAH ada di IFLIX,bebas biaya langganan utk AXISers!Beli BRONET24Jam 8GB Rp61.900 buat nonton di *123*888# bsk di RAWIT.Info838.AXIS007",2018-01-16 09:11:00
"ham","13/01/2018 15:10 Pada No. Rek 378088918 ada dana keluar sebesar Rp 105.440,00. Saldo akhir: Rp 3.558.354,00.Berita: TRF PAY TOP UP ECHANNEL.",2018-01-16 05:20:00
"spam","Sudah punya Sticker Music terbaru dr LINE? Kalau belum,ayo beli pakai pulsa IM3Ooredoo & dptkan hadiah Headphone Beats serta hadiah lainnya bit.ly/IM3Line SPI2",2018-01-14 11:08:00
"ham","13/01/2018 14:46 Pada No. Rek 378088918 ada dana keluar sebesar Rp 400.000,00. Saldo akhir: Rp 3.663.794,00.Berita: BILL PAYMENT  GOPAY CUST    NO  241515829324",2018-01-13 14:46:00
"ham","BNI SMS BANKING:13/01/2018 14:42 TOP GOPAY CUSTOMER 085722688068 Nama:tiara Rp.400.000 Berhasil. Reff:642476",2018-01-13 14:42:00
"ham","13/01/2018 14:42 TOP GOPAY CUSTOMER 085722688068 Nama:tiara Rp.400.000 ketik digit ke-4&1 PIN Anda",2018-01-13 14:42:00
"spam","BARU! OBROL Sepuasnya 24 Jam ke sesama IM3 Ooredoo. Ayo daftar paketnya di *123*999# atau di MyIM3",2018-01-13 14:40:00
"spam","TOPUP pulsa Rp 25000 berhasil via I-BANKING CIMB_NIAGA kode trx 0113144020220668. Pulsa anda saat ini Rp 25160. Terima kasih telah menggunakan INDOSAT OOREDOO",2018-01-13 14:40:00
"spam","Ayo beli & gunakan Sticker Music LINE pakai pulsa IM3 Ooredoo, dan dapatkan hadiah Headphone Beats serta Merchandise LINE lainnya. Info: bit.ly/IM3Line SPI1",2018-01-13 08:10:00
"ham","Untuk mengindari PEMBLOKIRAN, Pemerintah mewajibkan SEGERA REGISTRASI ULANG kartu Anda. Ketik: ULANG#NIK#No.KK# kirim SMS ke4444, klik: http://im3.do/registrasi",2018-01-12 09:17:00
"ham","Pulsa Anda tdk mencukupi u/ menerima layanan  dr shortcode 3346 sebesar Rp./sms. Silahkan Isi ulang.
",2018-01-11 21:08:00
"ham","Kak...tolong d angkat...gojek...alnya iced chocolate nya kosong....bagaimana?",2018-01-11 16:27:00
"spam","BARU! KUOTA UTAMA BESAR & UNLIMITED BONUS gak habis-habis utk YouTube, SosMed, & Streaming 24Jam tanpa bayar lebih dr IM3Ooredoo.Info http://im3.do/ul0111 MAI1",2018-01-11 11:52:00
"spam","(AXIS) Kuota paket data kamu di SENIN-JUMAT hanya 20% lagi. Cek aplikasi AXISnet atau telp *889# untuk melihat detail pemakaian kamu. Info838",2018-01-11 08:28:00
"spam","Info dana tunai cepat JAMlNAN B -- P -- K -- B Mobil/Truk Leasing resmi Pencairan besar,bunga ringan,TANPA BI CHECKING.

PENDI
SMS/TELP/Whatsapp 081213000835",2018-01-11 08:27:00
"spam","Info dana tunai cepat JAMlNAN B -- P -- K -- B Mobil/Truk Leasing resmi TANPA BI CHECKING

PENDI
SMS/TELP/Whatsapp: 081213000835",2018-01-10 17:16:00
"spam","RABU WAJIB IRIT besok!! Promo BRONET 24Jam 8GB 30hr hny Rp61.900 dg akses *123*888# / app AXISnet dr HP. Klaim BONUS 1GB setelah pembelian!! Info838. AXIS007",2018-01-09 16:22:00
"spam","BARU! KUOTA UTAMA BESAR & UNLIMITED BONUS gak habis-habis utk YouTube, SosMed, & Streaming 24Jam tanpa bayar lebih dr IM3Ooredoo.Info http://bit.ly/2CrSDcE MAI1",2018-01-09 13:27:00
"spam","Trm ksh telah memilih Indosat Ooredoo. Secara keseluruhan, seberapa mungkin Anda merekomendasikan kami ke rekan/klrg? Balas N0 sd N10 (N10=tertinggi), GRATIS",2018-01-08 08:29:00
"ham","07/01/2018 18:59 Pada No. Rek 378088918 ada dana keluar sebesar Rp 209.000,00. Saldo akhir: Rp 4.063.794,00.Berita: TRF PAY TOP UP ECHANNEL.",2018-01-07 19:00:00
"spam","TIKETUX U/ LINTAS
D/H MGO/CIPAGANTI
KE SOETTA NAIK DARI CIHAMPELAS CM 150rb
goo.gl/maps/1jYYWYn8jAF2
BELI TIKET DI SOETTA
DAPAT VOUCHER 20rb
UTK KE SOETTA LAGI",2018-01-07 18:19:00
"spam","awas ketinggalan iRing Nella Kharisma-Jaran Goyang (AT17), Rp.0,1/3hr prpnjngan Rp.3190 .Lngsung bls YA aja ya!",2018-01-06 21:25:00
"ham","Iya mba",2018-01-06 17:41:00
"spam","Pelanggan Yth, Pulsa Anda tdk cukup. Tersedia PULSA SIAGA utk Anda, pembyran dilakukan saat isi pulsa, hub *911# atau bls SMS ini ktk 0",2018-01-06 17:38:00
"ham","06/01/2018 17:21 Pada No. Rek 378088918 ada dana keluar sebesar Rp 300.000,00. Saldo akhir: Rp 4.272.794,00.Berita: BILL PAYMENT  GOPAY CUST    NO  311515233979",2018-01-06 17:21:00
"ham","BNI SMS BANKING:06/01/2018 17:19 TOP GOPAY CUSTOMER 085722688068 Nama:tiara Rp.300.000 Berhasil. Reff:240815",2018-01-06 17:19:00
"ham","06/01/2018 17:19 TOP GOPAY CUSTOMER 085722688068 Nama:tiara Rp.300.000 ketik digit ke-5&6 PIN Anda",2018-01-06 17:19:00
"ham","Pulsa Anda tdk mencukupi u/ menerima layanan  dr shortcode 3346 sebesar Rp./sms. Silahkan Isi ulang.
",2018-01-06 17:19:00
"ham","Skli lagi",2018-01-06 17:05:00
"spam","awas ketinggalan iRing Nella Kharisma-Jaran Goyang (AT17), Rp.0,1/3hr prpnjngan Rp.3190 .Lngsung bls YA aja ya!",2018-01-05 20:52:00
"spam","STAR WARS Series ada di IFLIX,bebas biaya langganan utk AXISers!!Pake BRONET DAYZ 8GB Rp49.000 buat nonton,beli di *123*888# hny di JUMAT BAIK!!Info838.AXIS007",2018-01-05 15:32:00
"spam","iRing keren cuman buat km, Repvblik-Aku Takut (AT17),Rp.0,1/3hr prpnjngan Rp.3190 dengan hnya bls YA lho!",2018-01-04 21:38:00
"ham","Go Mobile
04Jan18 20:46
Ref 01040024991877
Trf Dana ke
700028224100
SUMINAR BUDIARANI
IDR 700,000.00
SUKSES",2018-01-04 20:46:00
"ham","04/01/2018 20:45:40 Ref 0104061863 Passcode 2716 untuk LOGIN Go Mobile CIMB Niaga. Passcode bersifat RAHASIA. Jangan beri ke siapapun!",2018-01-04 20:45:00
"ham","04/01/2018 20:38 Pada No. Rek 378088918 ada dana keluar sebesar Rp 800.000,00. Saldo akhir: Rp 2.858.057,00.Berita: TARIK TUNAI.",2018-01-04 20:38:00
"spam","Paket internet Extra, kuota 1 GB, Rp 10rb. Ketik D21 ke 929 sd 05/01/18.",2018-01-03 12:55:00
"spam","PULSA SOS Anda telah diaktifkan, berlaku sd 2018-01-05 dan biaya  Rp 2000  bea jasa Rp 500 akan dipotong saat isi Pulsa. Pulsa dpt digunakan ke semua operator.",2018-01-03 10:20:00
"ham","Go Mobile
03Jan18 09:31
Ref 01030024213552
Trf Dana ke
800142351700
GOPAY Bram Galih Arianto
IDR 12,000.00
SUKSES",2018-01-03 09:31:00
"ham","Go Mobile
03Jan18 09:29
Ref 01030024212880
Trf Dana ke
800142351700
GOPAY tiara
IDR 100,000.00
SUKSES",2018-01-03 09:29:00
"ham","03/01/2018 09:28:06 Ref 0103011726 Passcode 4308 untuk LOGIN Go Mobile CIMB Niaga. Passcode bersifat RAHASIA. Jangan beri ke siapapun!",2018-01-03 09:28:00
"spam","Anda dipotong biaya Rp 2500 untuk pemakaian layanan PULSA/PAKET SOS. ",2018-01-03 09:25:00
"spam","TOPUP pulsa Rp 25000 berhasil via SMSBANKING CIMB_NIAGA kode trx 0103092504860181. Pulsa anda saat ini Rp 22631. Terima kasih telah menggunakan INDOSAT OOREDOO",2018-01-03 09:25:00
"ham","02/01/2018 18:26 Pada No. Rek 378088918 ada dana keluar sebesar Rp 100.000,00. Saldo akhir: Rp 3.658.057,00.Berita: TARIK TUNAI.",2018-01-02 18:27:00
"ham","02/01/2018 08:40 Pada No. Rek 378088918 ada dana keluar sebesar Rp 300.000,00. Saldo akhir: Rp 3.808.057,00.Berita: TARIK TUNAI.",2018-01-02 08:56:00
"spam","iRing keren cuman buat km, Nella Kharisma ft Monata-Konco Mesra (AT17),Rp.0,1/3hr prpnjngan Rp.3190 dengan hnya bls YA lho!",2018-01-01 21:36:00
"ham","Telegram code 53271",2018-01-01 20:38:00
"ham","Telegram code 53271",2018-01-01 20:37:00
"spam","Pelanggan Yth, Pulsa Anda tdk cukup. Tersedia PULSA SIAGA utk Anda, pembyran dilakukan saat isi pulsa, hub *911# atau bls SMS ini ktk 0",2018-01-01 10:08:00
"spam","awas ketinggalan iRing Nella Kharisma-Jaran Goyang (AT17), Rp.0,1/3hr prpnjngan Rp.3190 .Lngsung bls YA aja ya!",2017-12-31 20:29:00
"ham","Waktu Tunggu konfirmasi dari nomor +6285721812244 habis ",2017-12-31 20:28:00
"ham","Waktu Tunggu konfirmasi dari nomor +6285721812244 habis ",2017-12-31 18:41:00
"ham","No +6285721812244 tdk berhasil SMS kamu. Jgn sampai kamu melewatkan pesan darinya! Balas YA dgn biaya Rp 399. Info: *123*883#",2017-12-31 17:28:00
"ham","No +6285721812244 tdk berhasil SMS kamu. Jgn sampai kamu melewatkan pesan darinya! Balas YA dgn biaya Rp 399. Info: *123*883#",2017-12-31 15:41:00
"ham","30/12/2017 21:20 Pada No. Rek 378088918 ada dana keluar sebesar Rp 269.201,00. Saldo akhir: Rp 4.112.702,00.Berita: TRF PAY TOP UP ECHANNEL.",2017-12-30 21:20:00
"spam","iRing keren cuman buat km, Repvblik-Aku Takut (AT17),Rp.0,1/3hr prpnjngan Rp.3190 dengan hnya bls YA lho!",2017-12-30 21:09:00
"ham","Iya, aku jg sih",2017-12-30 18:03:00
"ham","Caw ti ?",2017-12-30 17:43:00
"ham","Ti, bilangin ke ruchi dong wait gitu, aku ga ada pulsa bls",2017-12-30 17:43:00
"ham","Oke oke",2017-12-30 12:06:00
"ham","Stengah 7 malem ini ?",2017-12-30 11:56:00
"ham","Aku jd ga enak loh",2017-12-30 10:24:00
"ham","Maafin loh ti",2017-12-30 09:34:00
"ham","Aduh maafkan aku tepar",2017-12-30 09:27:00
"ham","Yes",2017-12-30 08:27:00
"spam","Pelanggan Yth, Pulsa Anda tdk mencukupi. Tersedia PULSA SIAGA utk Anda, pembyran dilakukan saat isi pulsa, hub *911# atau bls SMS ini ktk 0",2017-12-29 23:05:00
"spam","Pelanggan Yth, Pulsa Anda tdk mencukupi. Tersedia PULSA SIAGA utk Anda, pembyran dilakukan saat isi pulsa, hub *911# atau bls SMS ini ktk 0",2017-12-29 23:04:00
"ham","Kayanya sih",2017-12-29 19:22:00
"ham","Masih lama da, sasa jg lg kerumah dulu mau nganter ibunya dulu",2017-12-29 19:20:00
"ham","Pada nanyain doang sih wkwkwk",2017-12-29 19:19:00
"ham","29/12/2017 19:17 Pada No. Rek 378088918 ada dana keluar sebesar Rp 100.000,00. Saldo akhir: Rp 4.381.903,00.Berita: BILL PAYMENT  GOPAY CUST    NO  521514549382",2017-12-29 19:18:00
"ham","Otw ti ?",2017-12-29 19:17:00
"ham","BNI SMS BANKING:29/12/2017 19:10 TOP GOPAY CUSTOMER 085722688068 Nama:tiara Rp.100.000 Berhasil. Reff:682640",2017-12-29 19:10:00
"ham","29/12/2017 19:09 TOP GOPAY CUSTOMER 085722688068 Nama:tiara Rp.100.000 ketik digit ke-2&1 PIN Anda",2017-12-29 19:09:00
"ham","Jalan kampus 5b, no.5",2017-12-29 19:06:00
"ham","U ok ti?",2017-12-29 19:03:00
"ham","Aduhhh mba mohon maaf...sy ga bisa mba...mohon maaf ya mba",2017-12-29 18:01:00
"ham","Iy...ditunggu ya sbntr...sy sdh di stopan pasirkoja..lg macet stopan",2017-12-29 17:46:00
"spam","Pelanggan Yth, Pulsa Anda tdk cukup. Tersedia PULSA SIAGA utk Anda, pembyran dilakukan saat isi pulsa, hub *911# atau bls SMS ini ktk 0",2017-12-29 17:38:00
"spam","BARU! Nikmati paket internet TERBAIK untuk akses unlimited apps YouTube & NelpSMS ga habis-habis. Beli paketnya HANYA di*123# atau http://im3.do/m3",2017-12-29 17:38:00
"spam","Isi Voucher Regular 25K pd 29/12/17 17:38 dr GO-JEK SUKSES. TID:01093900003975041279",2017-12-29 17:38:00
"spam","Pelanggan Yth, Pulsa Anda tdk cukup. Tersedia PULSA SIAGA utk Anda, pembyran dilakukan saat isi pulsa, hub *911# atau bls SMS ini ktk 0",2017-12-29 17:35:00
"spam","Pelanggan Yth, Pulsa Anda tdk cukup. Tersedia PULSA SIAGA utk Anda, pembyran dilakukan saat isi pulsa, hub *911# atau bls SMS ini ktk 0",2017-12-29 17:33:00
"spam","Pelanggan Yth, Pulsa Anda tdk cukup. Tersedia PULSA SIAGA utk Anda, pembyran dilakukan saat isi pulsa, hub *911# atau bls SMS ini ktk 0",2017-12-29 17:32:00
"spam","Pelanggan Yth, Pulsa Anda tdk cukup. Tersedia PULSA SIAGA utk Anda, pembyran dilakukan saat isi pulsa, hub *911# atau bls SMS ini ktk 0",2017-12-29 17:32:00
"ham","Mending aku bawa sate pempek ato keripik",2017-12-29 16:05:00
"ham","Pulsa Anda tdk mencukupi u/ menerima layanan  dr shortcode 3346 sebesar Rp./sms. Silahkan Isi ulang.
",2017-12-29 15:41:00
"spam","Pulsamu <Rp500.Mau PULSA SOS 10000 bs dipakai ke SemuaOperator sd 5hr?Pembayaran Rp10000 & BeaJasa Rp3000 akan dipotong saat isi Pulsa.Balas YA ke 505 /tkn*505#",2017-12-29 15:40:00
"ham","Oke oke",2017-12-29 13:48:00
"ham","Km bawa apa ti ?",2017-12-29 13:47:00
"ham","Aku lg di jalan td, oke oke",2017-12-29 13:24:00
"spam","Dgn DATA ROLLOVER sisa kuota TIDAK HANGUS. Simpan sisa kuotamu smp 100GB slm SETAHUN. Gratis dgn pkt internet bulanan IM3Ooredoo. Info http://im3.do/dr1229 MAI1",2017-12-29 13:00:00
"ham","Ya ti ? Baru ada pulsa",2017-12-29 12:55:00
"ham","BNI SMS BANKING:29/12/2017 11:10 Trf Rp.87.000 ke 0327084946 an.Sdr   ERLANGGA telah berhasil. Reff: 939685.",2017-12-29 11:10:00
"ham","29/12/2017 11:09 Trf Rp 87000 ke 0327084946 an.Sdr   ERLANGGA.Utk diproses,reply sms ini,ketik digit ke-4&6 PIN Anda",2017-12-29 11:10:00
"ham","BNI SMS BANKING:29/12/2017 11:09 Transaksi tdk dpt diproses. Nomor HP Anda:08382888813 belum terdaftar BNI SMS Banking. Silahkan kunjungi Cabang BNI Terdekat",2017-12-29 11:09:00
"spam","Kamu internetan dg tarif perKB,pemakaian sd saat ini Rp7200.Mau INTERNETAN tnp khawatir kuota habis? Gunakan pkt UNLIMITED ! Beli *123# atau myIM3",2017-12-29 11:02:00
"spam","Hanya Rp75rb/bln utk Nelpon & SMS SEPUASNYA plus INTERNETAN sd 40GB (hrg normal Rp149rb). Aktifkan s.d 30/12/17, ketik MAU6 ke 929.",2017-12-29 10:40:00
"spam","Penawaran terbatas! Aktifkan Paket Khusus: IM3 Freedom Bundle hanya utk Smartphone Anda, balas SMS ke 990, ketik F50 dpt Kuota 12GB hanya Rp50rb/bln atau F25 dpt Kuota 2GB hanya Rp25rb/bln selama 12 bulan. Pastikan Pulsa Cukup.",2017-12-29 10:34:00
"spam","PAKET BRONET DAYZ 8GB  sudah aktif.Nikmati kuota 3GB 24Jam di SENIN-JUMAT & 5GB 24Jam di SABTU-MINGGU aktif s.d 27-01-2018.Cek PROMO di app AXISnet! Info838",2017-12-29 10:30:00
"spam","PAKET BRONET DAYZ 8GB 30hr kamu akan segera aktif. Temukan PROMO lainnya di aplikasi AXISnet. Kuota paket bisa dipake di Jaringan 4G juga lho! Info838",2017-12-29 10:30:00
"spam","Kamu internetan dg tarif perKB,pemakaian sd saat ini Rp7200.Mau INTERNETAN tnp khawatir kuota habis? Gunakan pkt UNLIMITED ! Beli *123# atau myIM3",2017-12-29 10:30:00
"spam","Isi ulang Rp50000.0 berhasil. Kode transaksi 55311229563659. Yuk registrasi ulang kartu AXIS kamu! Kirim SMS ke 4444 dgn format : ULANG#NIK#No.KK",2017-12-29 10:17:00
"spam","Pelanggan Yth, Pulsa Anda tdk mencukupi. Tersedia PULSA SIAGA utk Anda, pembyran dilakukan saat isi pulsa, hub *911# atau bls SMS ini ktk 0",2017-12-29 10:15:00
"ham","BNI SMS BANKING:29/12/2017 10:14 Topup XL ke nomor 08382888813 sebesar Rp. 50.000 berhasil. Reff: 10973062.",2017-12-29 10:14:00
"ham","29/12/2017 10:14 TOP XL No 08382888813 sebesar Rp 50000.Utk diproses,reply sms ini,ketik digit ke-5&6 PIN Anda",2017-12-29 10:14:00
"spam","Hanya 1hari lg! Dptkan BONUS PULSA Rp25rb utk isi ulang min Rp25rb (maks bonus Rp100rb). Bonus berlaku 3hari sesama IM3Ooredoo.Cek bonus *557*8#",2017-12-29 07:24:00
"ham","Kamu berada dlm masa tenggang atau Pulsa tdk mencukupi utk menerima Collect SMS dari +6285721812244. Info: *123*883#",2017-12-28 23:07:00
"ham","No +6285721812244 tdk berhasil SMS kamu. Jgn sampai kamu melewatkan pesan darinya! Balas YA dgn biaya Rp 399. Info: *123*883#",2017-12-28 21:45:00
"spam","Selamat datang di tarif  AXIS GAOL. GRATIS NELPON ke semua nomor AXIS dari jam 12 mlm - 5 sore SETIAP HARI. IRIT ITU AXIS.",2017-12-28 20:08:00
"ham","Silahkan matikan & hidupkan kembali HP Anda untuk mulai menggunakan",2017-12-28 20:08:00
"ham","Registrasi Prabayar Sukses. Data pelanggan sesuai identitas  Anda telah didaftarkan.",2017-12-28 20:07:00
"ham","Harap masukkan 1359 di LINE dalam 30 menit.",2017-12-28 17:07:00
"ham","G-679179 is your Google verification code.",2017-12-28 16:30:00
"ham","Pelanggan Yth.Kiriman dari OKKY PUTRA tgl 28-12-2017 No.15892405794 sdg dlm proses pengiriman. status bisa dicek di www.posindonesia.co.id",2017-12-28 16:13:00
"ham","Sy pake Calya silver d1321 AFV. ",2017-12-28 15:04:00
"ham","28/12/2017 15:01 Pada No. Rek 378088918 ada dana keluar sebesar Rp 210.788,00. Saldo akhir: Rp 4.618.903,00.Berita: TRF PAY TOP UP ECHANNEL.",2017-12-28 15:02:00
"ham","28/12/2017 11:05 Pada No. Rek 378088918 ada dana keluar sebesar Rp 309.000,00. Saldo akhir: Rp 4.829.691,00.Berita: 8277085722688068 TKP Tiara Dwiputri SMS.",2017-12-28 11:06:00
"ham","BNI SMS BANKING:28/12/2017 10:59 Trf Rp.309.000 ke 8277085722688068 an.TKP Tiara Dwiputri telah berhasil. Reff: 938715.",2017-12-28 10:59:00
"ham","28/12/2017 10:59 Trf Rp 309000 ke 8277085722688068 an.TKP Tiara Dwip.Utk diproses,reply sms ini,ketik digit ke-6&4 PIN Anda",2017-12-28 10:59:00
"spam","Kamu internetan dg tarif perKB,pemakaian sd saat ini Rp2700.Mau INTERNETAN tnp khawatir kuota habis? Gunakan pkt UNLIMITED ! Beli *123# atau myIM3",2017-12-27 22:54:00
"spam","Ayo diaktifkan iRing KERENnya, Anji-Bidadari Tak Bersayap (AT17) Rp.0,1/3hr prpnjngan Rp.3190 hnya dgn balas YA!",2017-12-27 20:31:00
"ham","Hai JDers! [508662] adalah kode verifikasi akun anda.",2017-12-27 20:08:00
"ham","3 hari lg prpanjangan Internet 2GB Rp45rb-30hr. Jgn lupa isi ulang pulsa utk dpt BONUS KUOTA sd 10GB di semua jaringan, DataRollover & trhindar tarif perKB. Ce",2017-12-27 16:56:00
"ham","Mohon kirimkan NIK dan Nomer Kartu Keluarga Anda. Ketik : Daftar#NIK#NomerKartuKeluarga kirim ke 4444. Contoh : DAFTAR#3212330419910000#3212340304199999",2017-12-27 16:16:00
"ham","27/12/2017 14:05 Pada No. Rek 378088918 ada dana keluar sebesar Rp 500.000,00. Saldo akhir: Rp 5.138.691,00.Berita: TARIK TUNAI.",2017-12-27 14:06:00
"ham","Weer",2017-12-27 14:00:00
"ham","Ku di deket deket lotte",2017-12-27 14:00:00
"ham","Where ti ?",2017-12-27 13:34:00
"ham","Oke",2017-12-27 12:50:00
"ham","Aku tunggu di bec deh ya",2017-12-27 12:49:00
"ham","Wah hahaha",2017-12-27 12:49:00
"ham","Km gabut ? Boleh boleh",2017-12-27 12:40:00
"ham","Iya masih di kampus hahaha",2017-12-27 12:36:00
"ham","Ga pake yg di dompet dulu aja ti belinya ? Kan ujungnya jg nominal pengeluaran sama pemasukannya tetap",2017-12-27 12:29:00
"ham","Ato ga hari ini ti dikirimnya ? Hahaha",2017-12-27 12:22:00
"ham","Udah beres sih",2017-12-27 12:18:00
"ham","Iya, tp nanti beres dari kampus",2017-12-27 11:00:00
"ham","BNI SMS BANKING:27/12/2017 10:52 Saldo rekening 0378088918 sebesar Rp. 88.691,00.",2017-12-27 10:52:00
"ham","27/12/2017 10:52 Informasi saldo rekening 378088918.Utk diproses,reply sms ini,ketik digit ke-2&5 PIN Anda",2017-12-27 10:52:00
"ham","Bec ga ti ?",2017-12-27 10:49:00
"spam","HOT PROMO! Hanya isi ulang pulsa min Rp25rb dpt BONUS PULSA min Rp25rb (maks bonus Rp100rb) s.d 30 Des 17.Bonus berlaku 3hr sesama IM3Ooredoo.Cek bonus *557*8#",2017-12-27 07:05:00
"ham","1 hari lg prpanjangan Internet 2GB Rp45rb-30hr. Jgn lupa isi ulang pulsa utk dpt BONUS KUOTA sd 10GB di semua jaringan, DataRollover & trhindar tarif perKB. Ce",2017-12-27 05:45:00
"ham","Dimana ti ?",2017-12-26 20:59:00
"ham","Where",2017-12-26 20:58:00
"ham","Oke wait",2017-12-26 20:39:00
"ham","Ku sana ga ?",2017-12-26 20:38:00
"ham","Where bro ?",2017-12-26 13:54:00
"ham","Woke",2017-12-26 13:48:00
"ham","Jadi bro aku sudah di stasiun",2017-12-26 13:47:00
"ham","Oke",2017-12-26 12:17:00
"ham","Stasiun bandung ? Mau ku jemput ga ? Btw si sasa jg mau ke stasiun nganter kakeknya",2017-12-26 12:01:00
"ham","Sedang bosan bro",2017-12-26 10:50:00
"ham","Bandungs ga ?",2017-12-26 10:32:00
"spam","Selamat! Paket internet Extra Rp 15rb kamu telah aktif dengan kuota 2 GB. Cek kuota *363#. Cek promo *929#",2017-12-26 09:06:00
"ham","Go Mobile
26Dec17 08:36
Ref 12260021173987
Trf Dana ke
800142351700
GOPAY tiara
IDR 100,000.00
SUKSES",2017-12-26 08:36:00
"ham","26/12/2017 08:34:48 Ref 1226005991 Passcode 0088 untuk LOGIN Go Mobile CIMB Niaga. Passcode bersifat RAHASIA. Jangan beri ke siapapun!",2017-12-26 08:34:00
"spam","Keyword yang anda kirimkan tidak terdaftar. Info detail www.indosatooredoo.com atau hub : 185",2017-12-26 08:22:00
"ham","Registrasi paket Anda sedang diproses. Pastikan settingan APN: indosatgprs. User, passwd & proxy dikosongkan. Restart HP Anda setelah registrasi berhasil.",2017-12-26 08:21:00
"ham","Anda masih terdaftar di paket Internet 2GB Rp45rb-30hr. Untuk pindah ke paket lain, terlebih dahulu ketik UNREG Internet 2GB Rp45rb-30hr kirim ke 123.Puas Inte",2017-12-26 08:20:00
"spam","Sisa kuota 10 MB. Beli ExtraKuota/Upgrade FreedomCombo, nikmati BONUS KUOTA sd 10GB disemua jaringan& DataRollover. Kelebihan pakai kena tarif perKB. Info *123",2017-12-25 22:13:00
"ham","Ya dah nati  tlp ya",2017-12-25 21:51:00
"ham","Ya",2017-12-25 21:18:00
"ham","2 hari lg prpanjangan Internet 2GB Rp45rb-30hr. Jgn lupa isi ulang pulsa utk dpt BONUS KUOTA sd 10GB di semua jaringan, DataRollover & trhindar tarif perKB. Ce",2017-12-25 20:03:00
"spam","Paket internet Extra, kuota 2GB, Rp 15rb. Ketik XD4 ke 929 sd27/12/17.",2017-12-25 12:55:00
"ham","Sisa kuota Kuota Utama: 19.8 MB, Kuota Malam 01.00-06.00: 9.8 GB. Beli EXTRA Kuota atau upgrade paket sekarang! Tekan *123# atau im3.do/mc",2017-12-25 12:20:00
"ham","Anda masih terdaftar di paket Internet 2GB Rp45rb-30hr. Untuk pindah ke paket lain, terlebih dahulu ketik UNREG Internet 2GB Rp45rb-30hr kirim ke 123.Puas Inte",2017-12-25 12:19:00
"ham","Registrasi paket Anda sedang diproses. Pastikan settingan APN: indosatgprs. User, passwd & proxy dikosongkan. Restart HP Anda setelah registrasi berhasil.",2017-12-25 12:19:00
"spam","?PromoNotif",2017-12-25 12:14:00
"spam","TOPUP pulsa Rp 50000 berhasil via ATM CIMB_NIAGA kode trx 1225121429617378. Pulsa anda saat ini Rp 50004. Terima kasih telah menggunakan INDOSAT OOREDOO",2017-12-25 12:14:00
"spam","Sisa kuota 39 MB. Beli ExtraKuota/Upgrade FreedomCombo, nikmati BONUS KUOTA sd 10GB disemua jaringan& DataRollover. Kelebihan pakai kena tarif perKB. Info *123",2017-12-25 00:58:00
"spam","Sisa kuota 39 MB. Beli ExtraKuota/Upgrade FreedomCombo, nikmati BONUS KUOTA sd 10GB disemua jaringan& DataRollover. Kelebihan pakai kena tarif perKB. Info *123",2017-12-24 22:27:00
"ham","3 hari lg prpanjangan Internet 2GB Rp45rb-30hr. Jgn lupa isi ulang pulsa utk dpt BONUS KUOTA sd 10GB di semua jaringan, DataRollover & trhindar tarif perKB. Ce",2017-12-24 20:15:00
"spam","Beli EXTRA kuota 1GB harga DISKON cuma Rp10rb. Ketik YA9 kirim ke 929 sd. 23/12/17",2017-12-23 13:34:00
"spam","Pulsamu <Rp500.Mau PULSA SOS 10000 bs dipakai ke SemuaOperator sd 5hr?Pembayaran Rp10000 & BeaJasa Rp3000 akan dipotong saat isi Pulsa.Balas YA ke 505 /tkn*505#",2017-12-23 10:46:00
"spam","Kamu internetan dg tarif perKB,pemakaian sd saat ini Rp14035.Mau INTERNETAN tnp khawatir kuota habis? Gunakan pkt UNLIMITED ! Beli *123# atau myIM3",2017-12-23 10:46:00
"spam","Sisa kuota 40 MB. Beli ExtraKuota/Upgrade FreedomCombo, nikmati BONUS KUOTA sd 10GB disemua jaringan& DataRollover. Kelebihan pakai kena tarif perKB. Info *123",2017-12-23 10:38:00
"spam","Sisa kuota 98 MB. Beli ExtraKuota/Upgrade FreedomCombo, nikmati BONUS KUOTA sd 10GB disemua jaringan& DataRollover. Kelebihan pakai kena tarif perKB. Info *123",2017-12-23 10:02:00
"spam","Sisa kuota 193 MB. Beli ExtraKuota/Upgrade FreedomCombo, nikmati BONUS KUOTA sd 10GB disemua jaringan& DataRollover. Kelebihan pakai kena tarif perKB. Info *12",2017-12-23 01:24:00
"spam","Anda berhenti berlangganan Nelpon Seharian. Nikmati kebebasan berkomunikasi dengan daftar Paket Nelpon tekan *123#",2017-12-22 21:35:00
"spam","Sisa kuota 298 MB. Beli ExtraKuota/Upgrade FreedomCombo, nikmati BONUS KUOTA sd 10GB disemua jaringan& DataRollover. Kelebihan pakai kena tarif perKB. Info *12",2017-12-22 21:12:00
"ham","Go Mobile
22Dec17 18:06
Ref 12220020397584
Trf Dana ke
800142351700
GOPAY tiara
IDR 150,000.00
SUKSES",2017-12-22 18:06:00
"ham","22/12/2017 18:04:31 Ref 1222060213 Passcode 5781 untuk LOGIN Go Mobile CIMB Niaga. Passcode bersifat RAHASIA. Jangan beri ke siapapun!",2017-12-22 18:04:00
"ham","22/12/2017 15:27:25 Ref 1222047640 Passcode 3838 untuk LOGIN Go Mobile CIMB Niaga. Passcode bersifat RAHASIA. Jangan beri ke siapapun!",2017-12-22 15:27:00
"ham","22/12/2017 15:26:57 Ref 1222047598 Passcode 4679 untuk LOGIN Go Mobile CIMB Niaga. Passcode bersifat RAHASIA. Jangan beri ke siapapun!",2017-12-22 15:26:00
"ham","Go Mobile
22Dec17 15:19
Ref 12220020286549
Trf Dana ke
800052048200
TOKOPEDIA
IDR 52,736.00
SUKSES",2017-12-22 15:19:00
"ham","22/12/2017 15:18:28 Ref 1222046794 Passcode 0324 untuk LOGIN Go Mobile CIMB Niaga. Passcode bersifat RAHASIA. Jangan beri ke siapapun!",2017-12-22 15:18:00
"ham","22/12/2017 15:07:05 Ref 1222045658 Passcode 6987 untuk LOGIN Go Mobile CIMB Niaga. Passcode bersifat RAHASIA. Jangan beri ke siapapun!",2017-12-22 15:07:00
"ham","BNI SMS BANKING:22/12/2017 13:42 Saldo rekening 0378088918 sebesar Rp. 88.691,00.",2017-12-22 13:42:00
"ham","22/12/2017 13:38 Informasi saldo rekening 378088918.Utk diproses,reply sms ini,ketik digit ke-1&4 PIN Anda",2017-12-22 13:38:00
"spam","Beli EXTRA kuota 1GB harga DISKON cuma Rp10rb. Ketik YA9 kirim ke 929 sd. 23/12/17 ",2017-12-22 13:34:00
"spam","Ayo tukarkan Poin Senyum kamu dg pilihan Paket layanan (Nelp,SMS, Internetan atau Masa Aktif) sblm 31 Des 2017 via *123*7887#. Cek poin: ketik POIN ke 7887",2017-12-22 12:36:00
"spam","Dgn DATA ROLLOVER sisa kuota TIDAK HANGUS. Simpan sisa kuotamu smp 100GB slm SETAHUN. Gratis dgn pkt internet bulanan IM3Ooredoo. Info http://im3.do/dr1222 MAI1",2017-12-22 12:27:00
"ham","Plgn 085722688068, +10 KOIN PULSA mu hari ini belum diambil? Hub *858*22# utk Ambil. Sayang lho ga diambil, bisa buat tuker pulsa. Hub *858*22# & Pilih 1 OK.",2017-12-22 10:18:00
"ham","Hahaha oke",2017-12-21 23:26:00
"spam","Spesial dari IM3! Nikmati OBROL SEPUASNYA 24 Jam ke Indosat Ooredoo. Paket Nelpon Harian ke sesama aktif sd 22/12/2017 21:57. Info *123# atau http://im3.do/mc",2017-12-21 21:57:00
"spam","BARU! Nikmati paket internet TERBAIK untuk akses unlimited apps YouTube & NelpSMS ga habis-habis. Beli paketnya HANYA di*123# atau http://im3.do/m3",2017-12-21 21:55:00
"spam","Isi Voucher Regular 25K pd 21/12/17 21:55 dr GO-JEK SUKSES. TID:01085600003887916946",2017-12-21 21:55:00
"ham","Sisa kuota Kuota Utama: 434.2 MB, Kuota Malam 01.00-06.00: 9.8 GB. Beli EXTRA Kuota atau upgrade paket sekarang! Tekan *123# atau im3.do/mc",2017-12-21 17:36:00
"spam","Kamu internetan dg tarif perKB,pemakaian sd saat ini Rp3305.Mau INTERNETAN tnp khawatir kuota habis? Gunakan pkt UNLIMITED ! Beli *123# atau myIM3",2017-12-21 11:28:00
"ham","Anda telah menerima pesan dari nomor +6287886411467, silahkan hubungi 0816122",2017-12-21 09:04:00
"ham","Jangan terkecoh! Bank tdk pernah meminta data rahasia Nasabah (PIN,password,userID) sbg syarat u/memberikan hadiah, pengkinian data, mengikuti program,dll.  ",2017-12-20 17:13:00
"ham","Get new Samsung Disc 10%+Disc 200K+Cashback 200K+0% up to 24 mos till 31 Dec 17.Register w/ CIMB Niaga email at shop.samsung .com/id_epp/cimbniaga.TC Info 14041",2017-12-20 13:55:00
"spam","Untuk internetan lebih nyaman, gunakan jaringan4G IndosatOoredoo. Nikmati Penawaran paket TERBAIK hanya di  *123# atau myIM3 http://im3.do/m3",2017-12-20 10:20:00
"spam","Kamu berada di jaringan 4G Indosat Ooredoo. Terus internetan dengan paket TERBAIK dan dapatkan penawarannya hanya di *123# atau myIM3 http://im3.do/m3",2017-12-20 03:37:00
"spam","Suka dengan film StarWars. Ayo beli sticker StarWars dan dapatkan diskon 50% dengan bayar pake pulsa IM3 Ooredoo, Klik bit.ly/Im3LINEStwr  SPI1",2017-12-18 15:33:00
"spam","Ayo dengarkan lagu New Rules dari Dua Lipa di Spotify Premium. Daftar 1 bulan dptkan gratis 3 bulan dengan pulsa IM3 Ooredoo, klik spoti.fi/2AuJ4ME SPI2",2017-12-18 11:34:00
"ham","18/12/2017 09:07 Pada No. Rek 378088918 ada dana keluar sebesar Rp 100.000,00. Saldo akhir: Rp 138.691,00.Berita: BILL PAYMENT  GOPAY CUST    NO  64151356253027",2017-12-18 09:07:00
"ham","BNI SMS BANKING:18/12/2017 09:03 TOP GOPAY CUSTOMER 085722688068 Nama:tiara Rp.100.000 Berhasil. Reff:390804",2017-12-18 09:03:00
"ham","18/12/2017 09:02 TOP GOPAY CUSTOMER 085722688068 Nama:tiara Rp.100.000 ketik digit ke-4&2 PIN Anda",2017-12-18 09:02:00
"ham","Traveloka.com: Your E-Ticket Summary

26-Dec-2017 / 10:30 / GMR-BD / V95LDQ 
Name: TIARA DWIPUTRI
Total: 1 passenger(s)",2017-12-17 23:44:00
"ham","Selamat pagi pak saya dri jd.id mau anter paket. Ini masuknya tower a atau tower b ya pak?",2017-12-17 09:53:00
"ham","16/12/2017 11:52 Pada No. Rek 378088918 ada dana keluar sebesar Rp 250.000,00. Saldo akhir: Rp 328.691,00.Berita: PENARIKAN TUNAI.",2017-12-16 11:52:00
"spam","Selamat..! SIM CARD
Anda terpilih menjadi
Pemenang dari
Pesta ISI ULANG
MOBOINDOSAT
Pin JK25FGR untk info
Slhkn kunjungi:
www.rejekimobo.blogspot.com",2017-12-16 06:22:00
"ham","Transaksi KartuKredit 428416XXXX3777,IDR 1,199,000.00 Tgl 2017-12-15 di FOOTGEAR SENCI,FG37 JAKARTA PUSATID Utk permintaan PIN, info:14041",2017-12-15 22:11:00
"spam","iRing keren cuman buat km, ANJI-Dia,Rp.0,1/3hr prpnjngan Rp.3190 dengan hnya bls YA lho!",2017-12-15 20:07:00
"ham","Get new Samsung Disc 10%+Disc 200K+Cashback 200K+0% up to 24 mos till 31 Dec 17.Register w/ CIMB Niaga email at shop.samsung .com/id_epp/cimbniaga.TC Info 14041",2017-12-15 17:05:00
"ham","Dear aspen, Pesanan anda dengan nomor 224019451 di jd.id sudah ada di jasa pengiriman, untuk info, email cs@jd.id",2017-12-15 15:27:00
"spam","Mau nonton film bioskop di rumah? Cukup tekan *123*6# dan pilih film yang kamu suka SPI1",2017-12-15 11:06:00
"spam","Dapatkan KADO SPESIAL dari Indosat Ooredoo. Paket NELPON SEPUASNYA ke sesama Indosat selama 7hari hanya Rp10rb. Ketik KADO2 kirim ke 919 sebelum 12 Des 2017",2017-12-15 08:45:00
"ham","BNI SMS BANKING:15/12/2017 07:44 Trf Rp 93000 ke BCA 0479086356/NIMAS PUTRI ASRINING ## telah berhasil Ref:065405-100000232099",2017-12-15 07:44:00
"ham","15/12/2017 07:44 Trf Rp93000 ke BCA 0479086356/NIMAS PUTRI ## Utk diproses,reply sms ini,ketik digit ke-1&5 PIN Anda",2017-12-15 07:44:00
"ham","BNI SMS BANKING:15/12/2017 07:41 Trf Rp.37.000 ke 0271528021 an.Sdri RENITA  LAVINIA telah berhasil. Reff: 972747.",2017-12-15 07:41:00
"ham","15/12/2017 07:40 Trf Rp 37000 ke 0271528021 an.Sdri RENITA  L.Utk diproses,reply sms ini,ketik digit ke-6&5 PIN Anda",2017-12-15 07:41:00
"ham","Hai JDers! (038249) adalah kode verifikasi akun anda.",2017-12-14 21:57:00
"spam","BARU! Nikmati paket internet TERBAIK untuk akses unlimited apps YouTube & NelpSMS ga habis-habis. Beli paketnya HANYA di*123# atau http://im3.do/m3",2017-12-14 19:51:00
"spam","TOPUP pulsa Rp 25000 berhasil via ATM CIMB_NIAGA kode trx 1214195151142391. Pulsa anda saat ini Rp 25071. Terima kasih telah menggunakan INDOSAT OOREDOO",2017-12-14 19:51:00
"spam","Ayo download aplikasi myIM3,dgn fitur Smart Data Control kamu bs hemat saat akses aplikasi & dptkan jg Penawaran Spesial dr myIM3.Info http://im3.do/mi1214 MAI1",2017-12-14 11:04:00
"ham","Pagi, sy dr GOJEK sedang menuju kesana.  Trims :-)",2017-12-14 08:57:00
"ham","Sy sdh di lobby",2017-12-13 08:56:00
"spam","Dgn DATA ROLLOVER sisa kuota TIDAK HANGUS. Simpan sisa kuotamu smp 100GB slm SETAHUN. Gratis dgn pkt internet bulanan IM3Ooredoo. Info http://im3.do/dr1212 MAI1",2017-12-12 12:42:00
"ham","Saya sudah di lobby bu",2017-12-12 09:10:00
"ham","Ok di tunggu yaa",2017-12-12 09:02:00
"spam","Ayo diaktifkan iRing KERENnya, Via Vallen-Sakit Sakit Hatiku (Reff) Rp.0,1/3hr prpnjngan Rp.3190 hnya dgn balas YA!",2017-12-11 20:24:00
"ham","11/12/2017 19:56 Pada No. Rek 378088918 ada dana keluar sebesar Rp 583.400,00. Saldo akhir: Rp 715.191,00.Berita: TRF PAY TOP UP ECHANNEL.",2017-12-11 19:56:00
"ham","BNI SMS BANKING:11/12/2017 19:53 Trf Rp 583400 ke BCA 2331654681/ANTON SUSILO ADI PUS ## telah berhasil Ref:393877-100000462078",2017-12-11 19:54:00
"ham","11/12/2017 19:53 Trf Rp583400 ke BCA 2331654681/ANTON SUSILO ## Utk diproses,reply sms ini,ketik digit ke-6&5 PIN Anda",2017-12-11 19:53:00
"ham","Ibu sy sdh di lobbi tower A mksh ",2017-12-11 09:13:00
"ham","Ibu di tunggu y mksh ",2017-12-11 09:00:00
"ham","Anda telah melakukan login dari perangkat baru. Apabila Anda tidak melakukannya silakan hubungi 14041.",2017-12-11 09:00:00
"ham","11/12/2017 08:56:28 Ref 1211007960 Passcode 0127 untuk LOGIN Go Mobile CIMB Niaga. Passcode bersifat RAHASIA. Jangan beri ke siapapun!",2017-12-11 08:56:00
"ham","BNI SMS BANKING:11/12/2017 08:53 TOP GOPAY CUSTOMER 085722688068 Nama:tiara Rp.50.000 Berhasil. Reff:352841",2017-12-11 08:53:00
"ham","11/12/2017 08:53 TOP GOPAY CUSTOMER 085722688068 Nama:tiara Rp.50.000 ketik digit ke-5&2 PIN Anda",2017-12-11 08:53:00
"spam","Uber: Anda mendapatkan potongan Rp 15000. untuk 10 perjalanan uberX/XL/POOL/UberBLACK Anda. Ayo pesan Uber-mu sekarang! http://t.uber.com/nguber",2017-12-10 23:07:00
"spam","iRing keren cuman buat km, Delondri-Demi Allah Aku Mencintaimu,Rp.0,1/3hr prpnjngan Rp.3190 dengan hnya bls YA lho!",2017-12-10 22:24:00
"ham","Td pagi jadi lari ga ti ? Aku baru ada pulsa",2017-12-10 18:45:00
"ham","10/12/2017 11:11 Pada No. Rek 378088918 ada dana keluar sebesar Rp 135.000,00. Saldo akhir: Rp 1.355.091,00.Berita: TRF PAY TOP UP ECHANNEL.",2017-12-10 11:11:00
"spam","Ayo diaktifkan iRing KERENnya, ILIR 7-Sakit Sungguh Sakit (Song) Rp.0,1/3hr prpnjngan Rp.3190 hnya dgn balas YA!",2017-12-09 20:28:00
"ham","Gojek d tunggu otw penjemputan",2017-12-09 15:21:00
"ham","Gojek d tunggu otw penjemputan",2017-12-09 15:20:00
"ham","Gojek d tunggu otw penjemputan",2017-12-09 15:20:00
"ham","Gojek d tunggu otw penjemputan",2017-12-09 15:20:00
"ham","Gojek d tunggu otw penjemputan",2017-12-09 15:20:00
"ham","Gojek d tunggu otw penjemputan",2017-12-09 15:20:00
"ham","Gojek d tunggu otw penjemputan",2017-12-09 15:20:00
"ham","Gojek d tunggu otw penjemputan",2017-12-09 15:20:00
"ham","Gojek d tunggu otw penjemputan",2017-12-09 15:20:00
"ham","Gojek d tunggu otw penjemputan",2017-12-09 15:20:00
"ham","BNI SMS BANKING:09/12/2017 14:06 Trf Rp.89.995 ke 8848000008197527 an.TIKET.COM-Tiara Dwiputri telah berhasil. Reff: 947148.",2017-12-09 14:06:00
"ham","09/12/2017 14:06 Trf Rp 89995 ke 8848000008197527 an.TIKET.COM-Tiar.Utk diproses,reply sms ini,ketik digit ke-5&4 PIN Anda",2017-12-09 14:06:00
"ham","No +6285721812244 tdk berhasil SMS kamu. Jgn sampai kamu melewatkan pesan darinya! Balas YA dgn biaya Rp 399. Info: *123*883#",2017-12-09 13:35:00
"spam","Cuma Rp165rb 1 bulan bisa dpt semua. INTERNETAN, SMS, NELPON SEPUASNYA KEMANAPUN + Free Unlimited Apps Streaming. Ayo tekan *123# dr ponsel kamu sekarang! CVI7",2017-12-09 10:17:00
"ham","09/12/2017 10:09 Pada No. Rek 378088918 ada dana keluar sebesar Rp 100.000,00. Saldo akhir: Rp 1.580.086,00.Berita: BILL PAYMENT  GOPAY CUST    NO  591512788823",2017-12-09 10:09:00
"ham","BNI SMS BANKING:09/12/2017 10:07 TOP GOPAY CUSTOMER 085722688068 Nama:tiara Rp.100.000 Berhasil. Reff:343149",2017-12-09 10:07:00
"ham","09/12/2017 10:07 TOP GOPAY CUSTOMER 085722688068 Nama:tiara Rp.100.000 ketik digit ke-1&4 PIN Anda",2017-12-09 10:07:00
"spam","Paket internet Extra, kuota 2GB, Rp 10rb. ketik XD1 ke 929 sd 11/12/17.",2017-12-09 09:52:00
"spam","BARU! Nikmati paket internet TERBAIK untuk akses unlimited apps YouTube & NelpSMS ga habis-habis. Beli paketnya HANYA di*123# atau http://im3.do/m3",2017-12-09 09:22:00
"spam","Isi Voucher Regular 25K pd 09/12/17 09:22 dr GO-JEK SUKSES. TID:01073200003753260892",2017-12-09 09:22:00
"spam","Apakah dalam 1 bulan terakhir Anda berlangganan layanan SMS konten i-ring/game/music/video dr Indosat Ooredoo? ketik YES1 jika iya atau NO1 jika tdk.GRATIS SPI1",2017-12-09 08:40:00
"ham","(CITITRANS)CT: Pesanan anda tujuan Dipati Ukur-Fatmawati pd 2017-12-10 11:15:00 dgn no kursi 6 tercatat dgn kode booking BOAP17120285534",2017-12-08 23:51:00
"spam","Kesempatan Terakhir, Ambil Kado Mu. Paket NELPON SEPUASNYA ke sesama Indosat selama 30hari hanya Rp20rb. Ketik KADO3 kirim ke 919 sekarang",2017-12-08 11:30:00
"spam","Penawaran terbatas! Aktifkan Paket Khusus: IM3 Freedom Bundle hanya utk Smartphone Anda, balas SMS ke 990, ketik F50 dpt Kuota 12GB hanya Rp50rb/bln atau F25 dpt Kuota 2GB hanya Rp25rb/bln selama 12 bulan. Pastikan Pulsa Cukup.",2017-12-08 10:12:00
"ham","Sisa kuota Kuota Utama: 2.0 GB, Kuota Malam 01.00-06.00: 9.8 GB, Kuota Aplikasi: 1.0 GB. Beli EXTRA Kuota atau upgrade paket sekarang! Tekan *123# atau im3.do/",2017-12-08 09:53:00
"ham","Pembelian item dari Spotify Premium seharga Rp. 49990 (belum termasuk PPN) telah berhasil. CS: s.fortumo.com/spotify",2017-12-07 22:03:00
"ham","Pin anda adalah 4354. s.fortumo.com",2017-12-07 22:02:00
"ham","Maaf, keyword yang Anda masukan salah. Untuk informasi lebih lanjut tekan *123# lalu OK/YES atau hub : 185",2017-12-07 22:01:00
"spam","TOPUP pulsa Rp 50000 berhasil via ATM BNI kode trx 1207220125194965. Pulsa anda saat ini Rp 59822. Terima kasih telah menggunakan INDOSAT OOREDOO",2017-12-07 22:01:00
"ham","BNI SMS BANKING:07/12/2017 22:01 Topup INDOSAT ke nomor 085722688068 sebesar Rp. 50.000 berhasil. Reff: 98823087.",2017-12-07 22:01:00
"ham","07/12/2017 22:01 TOP no 085722688068 sebesar Rp 50000.Utk diproses,reply sms ini,ketik digit ke-1&2 PIN Anda",2017-12-07 22:01:00
"ham","07/12/2017 21:45 Pada No. Rek 378088918 ada dana keluar sebesar Rp 100.000,00. Saldo akhir: Rp 1.730.086,00.Berita: PENARIKAN TUNAI.",2017-12-07 21:45:00
"spam","Dgn DATA ROLLOVER sisa kuota TIDAK HANGUS. Simpan sisa kuotamu smp 100GB slm SETAHUN. Gratis dgn pkt internet bulanan IM3Ooredoo. Info http://im3.do/dr1207 MAI1",2017-12-07 11:11:00
"spam","Dapatkan KADO SPESIAL dari Indosat Ooredoo. Paket NELPON SEPUASNYA ke sesama Indosat selama 30hari hanya Rp20rb. Ketik KADO3 kirim ke 919 sebelum 8 Des 2017",2017-12-07 10:44:00
"ham","Ok",2017-12-07 09:08:00
"ham","06/12/2017 21:18 Pada No. Rek 378088918 ada dana keluar sebesar Rp 108.900,00. Saldo akhir: Rp 1.882.085,00.Berita: TRF PAY TOP UP ECHANNEL.",2017-12-06 21:19:00
"ham","06/12/2017 20:58 Pada No. Rek 378088918 ada dana masuk sebesar Rp 100.000,00. Saldo akhir: Rp 1.990.985,00.Berita: KOR TARIK TUNAI ATM.",2017-12-06 21:01:00
"ham","06/12/2017 20:58 Pada No. Rek 378088918 ada dana masuk sebesar Rp 100.000,00. Saldo akhir: Rp 1.990.985,00.Berita: KOR TARIK TUNAI ATM.",2017-12-06 21:01:00
"ham","06/12/2017 20:58 Pada No. Rek 378088918 ada dana keluar sebesar Rp 100.000,00. Saldo akhir: Rp 1.890.985,00.Berita: PENARIKAN TUNAI.",2017-12-06 21:01:00
"ham","06/12/2017 20:58 Pada No. Rek 378088918 ada dana keluar sebesar Rp 100.000,00. Saldo akhir: Rp 1.890.985,00.Berita: PENARIKAN TUNAI.",2017-12-06 21:01:00
"spam","iRing keren cuman buat km, Repvblik-Selingkuh,Rp.0,1/3hr prpnjngan Rp.3190 dengan hnya bls YA lho!",2017-12-06 20:57:00
"ham","Saya di pintu  masuk  saya mundur  ya bu? ",2017-12-06 20:29:00
"ham","Sebentar  bu, ",2017-12-06 20:18:00
"spam","Ayo download aplikasi myIM3,dgn fitur Smart Data Control kamu bs hemat saat akses aplikasi & dptkan jg Penawaran Spesial dr myIM3.Info http://im3.do/mi1206 CMI4",2017-12-06 19:42:00
"spam","Ayo dengarkan lagu Despacito dari Justin Bieber di Spotify Premium. Daftar 1 bulan dptkan gratis 3 bulan dengan pulsa IM3 Ooredoo, klik spoti.fi/2AuJ4ME CMI5",2017-12-06 19:32:00
"ham","Siang, maaf internetnya mati. Kondisi bolin hari ini masih lesu, sudah mau bangun berdiri, pis keluar dari kateter, makan dicekok",2017-12-06 14:32:00
"ham","(CITITRANS)CT: Pesanan anda tujuan Fatmawati-Dipati Ukur pd 2017-12-09 05:15:00 dgn no kursi 8 tercatat dgn kode booking BOAP17120276068",2017-12-06 10:10:00
"ham","Cancel aj ya nona ini kejauhan muter bliknya. Gojek",2017-12-05 21:40:00
"spam","Laper? Ayo pakai PayPro setiap hari Rabu di McDonalds & dptkan DISKON hingga Rp25rb. Tekan *123*4# atau melalui aplikasi myIM3. Info http://im3.do/ipp1205 MAI1",2017-12-05 15:40:00
"spam","Pelanggan 085722688068, Ada yang Ngajak Kamu Chatting. Hubungi *858*11# untuk baca. Pesan akan dihapus dalam 5 menit. Silakan hubungi *858*11# sekarang.",2017-12-05 13:32:00
"spam","Cuma Rp100rb 1 bulan dapat 10GB + Free Unlimited Apps Streaming +SMS Nelpon SEPUASNYA ke sesama. Ayo tekan *123# sekarang.Atau pilih Paket Favorit lainnya! CVI6",2017-12-05 12:22:00
"spam","Paket internet Extra, kuota 2GB, Rp 10rb. ketik XD1 ke 929 sd 07/12/17.",2017-12-05 10:13:00
"spam","BARU! Nikmati paket internet TERBAIK untuk akses unlimited apps YouTube & NelpSMS ga habis-habis. Beli paketnya HANYA di*123# atau http://im3.do/m3",2017-12-05 09:04:00
"spam","Isi Voucher Regular 25K pd 05/12/17 09:04 dr GO-JEK SUKSES. TID:01069600003713097026",2017-12-05 09:04:00
"spam","Pulsamu <Rp500.Mau PULSA SOS 10000 bs dipakai ke SemuaOperator sd 5hr?Pembayaran Rp10000 & BeaJasa Rp3000 akan dipotong saat isi Pulsa.Balas YA ke 505 /tkn*505#",2017-12-04 20:29:00
"spam","Sukseskan Sail Sabang 2017 tgl 25 November - 5 Desember 2017 di Pulau We, Kota Sabang. Untuk info lengkap kunjungi website: sailsabang2017.co.id",2017-12-04 14:14:00
"ham","KITABISA.COM: Zakat #762849 telah lewat batas waktu. Jika SUDAH TRANSFER atau ingin BERZAKAT ULANG, klik https://ktbs.in/3ef8d",2017-12-04 13:02:00
"spam","Uber: Anda mendapatkan potongan Rp 15000. untuk 10 perjalanan uberX/XL/POOL/UberBLACK Anda. Ayo pesan Uber-mu sekarang! http://t.uber.com/nguber",2017-12-03 23:44:00
"ham","KITABISA.COM REMINDER: Segera transfer pembayaran zakat #762849. Batas waktu s.d. 4 Dec 10:00 WIB. Abaikan jika sudah transfer.",2017-12-03 21:02:00
"spam","Paket internet Extra, kuota 2GB, Rp 10rb. ketik XD1 ke 929 sd 05/12/17.",2017-12-03 14:35:00
"ham","03/12/2017 13:23 Trf Rp 75745 ke 7878078003 an.KITA BISA berita: ZAKAT NOVEMBER.Utk diproses,reply sms ini,ketik digit ke-1&2 PIN Anda",2017-12-03 13:23:00
"ham","KITABISA.COM: Segera transfer TEPAT Rp 75.745 ke rek BNI 7878078003 an. YAYASAN KITA BISA utk zakat #762849 sebelum 4 Dec 10:00 WIB",2017-12-03 13:22:00
"spam","SELAMAT. GRATIS Nelpon SEPUASNYA Ke Semua No Indosat SEHARIAN bisa Kamu Nikmati. Ketik IM3LuvU kirim ke 919 sebelum 4 Des 2017 #IM3LuvU",2017-12-03 08:30:00
"ham","02/12/2017 13:21 Pada No. Rek 378088918 ada dana keluar sebesar Rp 190.344,00. Saldo akhir: Rp 2.090.885,00.Berita: TRF PAY TOP UP ECHANNEL.",2017-12-02 13:21:00
"ham","02/12/2017 10:34 Pada No. Rek 378088918 ada dana keluar sebesar Rp 200.000,00. Saldo akhir: Rp 2.281.229,00.Berita: BILL PAYMENT  GOPAY CUST    NO  551512185437",2017-12-02 10:35:00
"ham","BNI SMS BANKING:02/12/2017 10:31 TOP GOPAY CUSTOMER 085722688068 Nama:tiara Rp.200.000 Berhasil. Reff:281331",2017-12-02 10:31:00
"ham","02/12/2017 10:30 TOP GOPAY CUSTOMER 085722688068 Nama:tiara Rp.200.000 ketik digit ke-6&4 PIN Anda",2017-12-02 10:30:00
"ham","Diskon hingga Rp. 1 juta + Cicilan 0% hingga 24 bulan dgn Kartu Kredit di Best Denki Summarecon Mall Serpong, Periode 1 - 3 Des 2017. S&K Berlaku. Info 14041",2017-12-02 09:50:00
"spam","BEBAS INTERNETAN Selama 1 Bulan cuma Rp100rb. Free Unlimited Apps+Streaming. Tekan *123# Sekarang Dan Pilih Paket Favoritmu! CVI6",2017-12-01 10:13:00
"spam","Pelanggan 085722688068 Kamu dapat 1 pesan chat. Hubungi *606*6# untuk baca. Pesan akan dihapus dlm 5 menit. Silahkan hub *606*6# skrg",2017-11-30 17:25:00
"spam","Ayo download aplikasi myIM3,dgn fitur Smart Data Control kamu bs hemat saat akses aplikasi & dptkan jg Penawaran Spesial dr myIM3.Info http://im3.do/mi1130 MAI1",2017-11-30 13:01:00
"ham","BNI SMS BANKING:30/11/2017 12:32 Trf Rp.50.000 ke 0305953425 an.Sdr RANDY  AZZIS telah berhasil. Reff: 911210.",2017-11-30 12:33:00
"ham","30/11/2017 12:32 Trf Rp 50000 ke 0305953425 an.Sdr RANDY  AZZ.Utk diproses,reply sms ini,ketik digit ke-6&1 PIN Anda",2017-11-30 12:32:00
"ham","BNI SMS BANKING:30/11/2017 10:48 Saldo rekening 0378088918 sebesar Rp. 2.537.208,00.",2017-11-30 10:49:00
"ham","30/11/2017 10:47 Informasi saldo rekening 378088918.Utk diproses,reply sms ini,ketik digit ke-4&6 PIN Anda",2017-11-30 10:48:00
"ham","Sy sudah dihalte durentiga arah kuningan",2017-11-30 09:49:00
"spam","Temanmu pake iRing keren Ungu - Cinta Dalam Hati ,mau juga? Balas SMS dgn Mau . Promo Rp.0,1/3hr, prpanjang Rp.3190/7hr.",2017-11-29 20:35:00
"ham"," maaf mba tlg dibntu di cancel,
sya mau gnti helm sma jaket dahulu,
soalnya helm nya basah mba.
terima kasih.",2017-11-29 19:56:00
"spam","Dgn DATA ROLLOVER sisa kuota TIDAK HANGUS. Simpan sisa kuotamu smp 100GB slm SETAHUN. Gratis dgn pkt internet bulanan IM3Ooredoo. Info http://im3.do/dr1129 MAI1",2017-11-29 18:05:00
"spam","Selamat, kamu dpt cashback 20% saldo PayPro krn sdh melakukan isi pulsa.Registrasi & download aplikasi PayPro di http://bit.ly/PP_ISAT.Info @indosatcare PAI9",2017-11-29 16:11:00
"ham","Mba maaf gaada uang parkir saya mba
Sya sudah sampe depan tower a",2017-11-29 08:59:00
"ham","Selamaat pagi dari gojek
Saya sudah berada di one bellpark 
Posisinya dimana yaa mba?
Trimakasih",2017-11-29 08:54:00
"spam","Paket internet Extra, kuota 1 GB, Rp 10rb. Ketik D21 ke 929 sd 01/12/17.",2017-11-29 06:18:00
"ham","BNI SMS BANKING:28/11/2017 21:10 Saldo rekening 0378088918 sebesar Rp. 53.338,00.",2017-11-28 21:10:00
"ham","28/11/2017 21:08 Informasi saldo rekening 378088918.Utk diproses,reply sms ini,ketik digit ke-4&5 PIN Anda",2017-11-28 21:08:00
"spam","Ayo dengarkan lagu Perfect dari Ed Sheeran di Spotify Premium. Daftar 1 bulan dptkan gratis 3 bulan dengan pulsa IM3 Ooredoo: spoti.fi/2AuJ4ME SPI1",2017-11-28 16:59:00
"spam","Nelp kerabat Anda di Asia, Eropa, Australia dan AS lebih hemat dg Paket FlatCall 01016, mulai Rp10rb/hr. Tekan*122*4*2#. Info: indosatooredoo.com/flatcall PAI10",2017-11-28 14:55:00
"spam","Pelanggan 085722688068, Kamu dapat 1 Pesan Chat. Hubungi *700*1# untuk baca. Pesan akan dihapus dlm 5 menit. Silakan hub *700*1# skrg",2017-11-28 13:26:00
"ham","Cashback up to IDR500,000 + 0% installment up to 24months with Credit Card at Selected Outlet Erafone and Urban Republic. 17Nov-3Des 2017. T&C apply. Info 14041",2017-11-28 09:50:00
"ham","Sisa kuota Kuota Utama: 2.0 GB, Kuota Malam 01.00-06.00: 10.0 GB, Kuota Aplikasi: 4.0 GB. Beli EXTRA Kuota atau upgrade paket sekarang! Tekan *123# atau im3.do",2017-11-27 19:43:00
"ham","Sisa Kuota Utama  & DATA ROLLOVER kamu sebelumnya sebesar 0MB berhasil diakumulasi. Total Kuota DATA ROLLOVER & Kuota Utama 2048MB, berlaku sd 27/12/2017 19:41",2017-11-27 19:41:00
"ham","BARU! Nikmati apps sehari-hari TANPA KUOTA dan DATA ROLLOVER sisa kuota utama kamu bisa di pakai sd setahun. Info *123# atau http://im3.do/mc",2017-11-27 19:41:00
"ham","Khusus buat kamu pelanggan IM3Ooredoo,nikmati nonton ribuan film melalui IFLIX,TANPA BIAYA BERLANGGANAN. Download di http://im3.do/iflix & lgs nikmati filmnya!",2017-11-27 19:41:00
"ham","Apakah anda yakin mendaftar paket Internet 2GB Rp45rb-30hr? Sisa kuota 24jam dari paket sebelumnya (Freedom M Rp 59rb/30hr) akan di akumulasikan, balas OK jika",2017-11-27 19:41:00
"spam","TOPUP pulsa Rp 25000 berhasil via ATM CIMB_NIAGA kode trx 1127193944717429. Pulsa anda saat ini Rp 72672. Terima kasih telah menggunakan INDOSAT OOREDOO",2017-11-27 19:39:00
"spam","'GRATIS YouTube & Instagram selama 3 hari hanya di aplikasi myIM3. Download aplikasinya sekarang di http://bit.ly/myim3arn",2017-11-27 19:39:00
"ham","ES 12th Anniversary! Cashback up to IDR 1,000,000 + 0% up to 12 months with Credit Card at all Electronic Solution stores.6 Oct-3 Dec 17. T&C apply. Info 14041",2017-11-27 10:31:00
"ham","Maaf, pulsa kamu tdk mencukupi. Isi pulsa & aktifkan FreedomCombo utk nikmati BONUS KUOTA s.d 10GB di semua jaringan.Info *123# atau http://im3.do/NV",2017-11-27 10:10:00
"ham","Gak mau wkwkwkkwkw",2017-11-27 10:00:00
"ham","No +6285655581596 tdk berhasil SMS kamu. Jgn sampai kamu melewatkan pesan darinya! Balas YA dgn biaya Rp 399. Info: *123*883#",2017-11-27 09:59:00
"ham","Maaf, pulsa kamu tdk mencukupi. Isi pulsa & aktifkan FreedomCombo utk nikmati BONUS KUOTA s.d 10GB di semua jaringan.Info *123# atau http://im3.do/NV",2017-11-27 09:56:00
"ham","Apakah anda yakin mendaftar paket Internet 2GB Rp45rb-30hr? Sisa kuota 24jam dari paket sebelumnya (Freedom M Rp 59rb/30hr) akan di akumulasikan, balas OK jika",2017-11-27 09:56:00
"ham","Maaf, pulsa kamu tdk mencukupi. Isi pulsa & aktifkan FreedomCombo utk nikmati BONUS KUOTA s.d 10GB di semua jaringan.Info *123# atau http://im3.do/NV",2017-11-27 09:55:00
"ham","Apakah anda yakin mendaftar paket Internet 2GB Rp45rb-30hr? Sisa kuota 24jam dari paket sebelumnya (Freedom M Rp 59rb/30hr) akan di akumulasikan, balas OK jika",2017-11-27 09:55:00
"ham","Sip",2017-11-27 09:54:00
"spam","Freedom Combo semakin lengkap! Nikmati BONUS KUOTA sd 10GB di semua jaringan, Apps Tanpa Kuota, DataRollover, Unlimited Nelp sesama.Info *123# atau im3.do/NV",2017-11-27 09:52:00
"ham","Udah ada ?",2017-11-27 09:52:00
"spam","Isi Voucher Regular 50K pd 27/11/17 09:52 dr Ciufa 2 SUKSES. TID:01061300003628262743",2017-11-27 09:52:00
"ham","Santai",2017-11-27 09:50:00
"ham","Lg dirumah hahaha",2017-11-27 09:44:00
"ham","50 kan ti ? Bentar",2017-11-27 09:43:00
"ham","Sisa kuota Kuota Malam: 4.6 GB. Beli Extra Kuota/upgrade Fredoom Combo di *123#  atau http://im3.do/mc",2017-11-27 09:34:00
"spam","Pkt Freedom Xl 30 hari Rp149rb dengan kuota 8GB + 12GB (4G) + nelpon sepuasnya ke sesama Indosat Ooredoo. Ketik C4 ke 929 sd 29/11/17",2017-11-27 06:53:00
"spam","iRing keren cuman buat km, Nella Kharisma ft Monata-Konco Mesra (AT17),Rp.0,1/3hr prpnjngan Rp.3190 dengan hnya bls YA lho!",2017-11-26 21:22:00
"spam","Kuota internet habis, pemakaian pakai trf perKB. Beli Extra/Upgrade FreedomCombo, nikmati akses Apps SEPUASNYA, BONUS KUOTA dan Data Rollover. Info im3.do/mc",2017-11-26 19:39:00
"spam","Sisa kuota 8 MB. Beli Extra Kuota/Upgrade FreedomCombo, nikmati akses APPS & YouTube SEPUASNYA serta DataRollover. Kelebihan pakai kena trf perKB. Info *123#",2017-11-26 16:09:00
"ham","Mba sy depan citos",2017-11-26 16:02:00
"spam","Pulsamu <Rp500.Mau PULSA SOS 10000 bs dipakai ke SemuaOperator sd 5hr?Pembayaran Rp10000 & BeaJasa Rp3000 akan dipotong saat isi Pulsa.Balas YA ke 505 /tkn*505#",2017-11-26 14:38:00
"spam","Sisa kuota 98 MB. Beli Extra Kuota/Upgrade FreedomCombo, nikmati akses APPS & YouTube SEPUASNYA serta DataRollover. Kelebihan pakai kena trf perKB. Info *123#",2017-11-26 12:30:00
"spam","Sisa kuota 151 MB. Beli Extra Kuota/Upgrade FreedomCombo, nikmati akses APPS & YouTube SEPUASNYA serta DataRollover. Kelebihan pakai kena trf perKB. Info *123#",2017-11-26 12:07:00
"spam","Ayo diaktifkan iRing KERENnya, Via Vallen-Selingkuh (DM17) Rp.0,1/3hr prpnjngan Rp.3190 hnya dgn balas YA!",2017-11-25 20:37:00
"spam","Sisa kuota 299 MB. Beli Extra Kuota/Upgrade FreedomCombo, nikmati akses APPS & YouTube SEPUASNYA serta DataRollover. Kelebihan pakai kena trf perKB. Info *123#",2017-11-25 10:38:00
"spam","Terimakasih tlh setia menggunakan IM3.Kini km BEBAS nelp kapanpun ke semua IM3 meskipun pulsa kurang dr 5rb.Pakai terus IM3mu & tunggu kejutannya #IM3LuvU CVI8",2017-11-25 09:46:00
"ham","(CITITRANS)CT: Pesanan anda tujuan Fatmawati-Dipati Ukur pd 2017-11-25 05:45:00 dgn no kursi 3 tercatat dgn kode booking BOFT1711251511562831241400",2017-11-25 05:33:00
"spam","LAPER? Pakai PAYPRO tiap hr Rabu di McDonalds. Dapet DISKON hingga 25rb!cukup dgn *123*4# atau aplikasi myIM3 http://im3.do/ipp1128 MAI1",2017-11-24 19:27:00
"spam","Lebih hemat beli paket Freedom Combo 12GB di aplikasi myIM3, hanya Rp50ribu. Ayo download aplikasi myIM3 sekarang, klik http://bit.ly/myim3frm",2017-11-24 18:09:00
"spam","Weekend ini asiknya main games bareng teman! Ayo pilih games yang mau kamu mainkan dengan teman-mu, tekan *123*6# SPI2",2017-11-24 14:47:00
"spam","Selamat.No anda
Terpilih sebagai
Pemenang ke.2
Dr.PT.M-TRONIK
BERKAT Isi ulang
PULSA Anda.2017
No.PIN;25e477r
U/Info lanjut klik
www.undianresmimtronik.ga",2017-11-24 14:10:00
"ham","Saya udah di depan loby bu",2017-11-24 10:51:00
"ham","(CITITRANS)CT: Pesanan anda tujuan Dipati Ukur-Fatmawati pd 2017-11-26 12:15:00 dgn no kursi 8 tercatat dgn kode booking BOAP17112238478",2017-11-24 09:02:00
"spam","BARU! INTERNET MANIA, BONUS hingga 20GB+YouTube SEPUASNYA disemua jaringan! Ini Baru Internetan Seru! BURUAN kesempatan TERBATAS! klik http://im3.do/bn1124 MAI1",2017-11-23 13:26:00
"spam","LAPER? Pakai PAYPRO tiap hr Rabu di McDonalds. Dapet DISKON hingga 25rb!cukup dgn *123*4# atau aplikasi myIM3 http://im3.do/ipp1122 MAI1",2017-11-22 20:04:00
"spam","Terima Kasih tlh Setia Menggunakan IM3.Promo Baru IM3,Berapapun Pulsamu bs BEBAS Nelp Kapanpun Ke Semua No IM3.Tetap Pakai IM3&Tunggu Bonus Special dr Kami CVI1",2017-11-22 10:56:00
"ham","saya sudah d loby.tks",2017-11-22 10:22:00
"ham","bapak,pang
isiankeun pulsa
nu 10 rebu penting
085281210944
",2017-11-22 09:31:00
"spam","Ayo berlangganan & nonton film di Netflix dari hp dengan pulsa IM3 Ooredoo. Download klik bit.ly/Ntflx1 SPI1",2017-11-21 16:13:00
"ham","Harap masukkan 0403 di LINE dalam 30 menit.",2017-11-21 14:58:00
"spam"," Anda mendapatkan PROMO iRing Cita Citata-Bahagia itu sederhana (CER17) Rp 1100,1/3hr (trf berlangganan). Balas YA untuk aktifkan iRing",2017-11-21 14:05:00
"ham","Harap masukkan 3753 di LINE dalam 30 menit.",2017-11-21 13:47:00
"ham","(CITITRANS)CT: Pesanan anda tujuan Fatmawati-Dipati Ukur pd 2017-11-25 07:15:00 dgn no kursi 3 tercatat dgn kode booking BOAP17112229143",2017-11-21 09:21:00
"ham","Sya udh di depan loby mbak",2017-11-21 08:56:00
"ham","Harap masukkan 8544 di LINE dalam 30 menit.",2017-11-20 22:11:00
"spam","Kamu berada di jaringan 4G, trs internetan dgn Kuota4G. Nikmati akses APPS & YouTube SEPUASNYA, BONUS KUOTA, serta Data Rollover dgn Freedom Combo. Info *123#",2017-11-20 18:44:00
"spam","iRing keren cuman buat km, Nilam Gamma1 & Danang-PANAH ASMARA,Rp.0,1/3hr prpnjngan Rp.3190 dengan hnya bls YA lho!",2017-11-20 13:41:00
"spam","Nelp ke Malaysia, SG, HK,China,AS,Thai,Brunei,Korsel, &India dgn FlatCall 01016 hny Rp4rb & dpt Bonus Berlipat. Tkn 01016+Kode Negara+No telp. Info *122*2# PAI2",2017-11-20 13:27:00
"ham","Saya jemput nya di belakang rumah sakit apa yang di lobby
Gojek",2017-11-20 09:05:00
"spam","Untuk internetan lebih nyaman, gunakan jaringan4G IndosatOoredoo. Akses APPS & YouTube SEPUASNYA, BONUS KUOTA, serta DataRollover dgn Freedom Combo. Info *123#",2017-11-20 08:47:00
"ham","Posisi d mana mba",2017-11-20 08:46:00
"spam","Uber: Anda mendapatkan potongan Rp 5000. untuk 10 perjalanan uberMOTOR Anda. Ayo pesan Uber-mu sekarang! http://t.uber.com/nguber",2017-11-19 23:34:00
"ham","Sisa kuota Kuota Utama : 1.9 GB, Kuota Malam: 4.8 GB, Kuota Aplikasi: 8.7 MB. Beli Extra Kuota/upgrade Fredoom Combo di *123#  atau http://im3.do/mc",2017-11-19 22:41:00
"ham","Mi Account verification code: 6994. This OTP expires in 5 minutes.",2017-11-19 15:15:00
"ham","Tokopedia - 787546 adalah kode verifikasi untuk tambah akun bank. PENTING: Mohon tidak menyebarkan kode ke orang lain atau pihak Tokopedia, demi keamanan akun.",2017-11-19 14:54:00
"spam","awas ketinggalan iRing Radja-Syukur (2), Rp.0,1/3hr prpnjngan Rp.3190 .Lngsung bls YA aja ya!",2017-11-19 13:34:00
"spam","LAPER? Pakai PAYPRO tiap hr Rabu di McDonalds. Dapet DISKON hingga 25rb!cukup dgn *123*4# atau aplikasi myIM3 http://im3.do/ipp1115 MAI1",2017-11-17 13:40:00
"spam","Nelp ke Malaysia, SG, HK,China,AS,Thai,Brunei,Korsel, &India dgn FlatCall 01016 hny Rp4rb & dpt Bonus Berlipat. Tkn 01016+Kode Negara+No telp. Info *122*2# PAI1",2017-11-17 09:28:00
"spam","Ayo diaktifkan iRing KERENnya, Shah Rukh Khan-Kuch Kuch Hota Hai (SRK) Rp.0,1/3hr prpnjngan Rp.3190 hnya dgn balas YA!",2017-11-16 13:48:00
"ham","Your Grab Activation Code (GAC) is 0348",2017-11-16 12:27:00
"spam","Ayo klaim saldo PayPro Rp22.500 kamu untuk beli pulsa lagi. Registrasi dan download aplikasi PayPro di http://bit.ly/2yBmkJp. Info: http://im3.do/PayPro PAI14",2017-11-16 11:27:00
"spam","Pelanggan 085722688068, kamu dapat 1 pesan & video seru. Hub *323*6# utk baca pesan. Pesan akan dihapus dalam 5 menit, hub *323*6# skrng.",2017-11-16 11:16:00
"ham","Sisa kuota Kuota Utama : 2.0 GB, Kuota Malam: 4.8 GB, Kuota Aplikasi: 879.8 MB. Beli Extra Kuota/upgrade Fredoom Combo di *123#  atau http://im3.do/mc",2017-11-16 08:45:00
"spam","BARU! INTERNET MANIA, BONUS hingga 20GB+YouTube SEPUASNYA disemua jaringan! Ini Baru Internetan Seru! BURUAN kesempatan TERBATAS! klik http://im3.do/bn1114 MAI1",2017-11-15 21:59:00
"spam","BARU! INTERNET MANIA, BONUS hingga 20GB+YouTube SEPUASNYA disemua jaringan! Ini Baru Internetan Seru! BURUAN kesempatan TERBATAS! klik http://im3.do/bn1114 MAI1",2017-11-15 15:12:00
"spam","Maaf atas ketidakpuasan Anda.Hal apa yg bs mningkatkn kepuasan Anda? J1-Proses isi ulang lbh cepat J2-Konfirmasi lbh cepat Ktk J1/J2.FREE",2017-11-15 11:39:00
"spam","Trm ksh Anda sdh internetan dgn IndosatOoredoo. Brdasar pngalamn Anda,sberapa puas Anda thdp kualitas internet kami? Balas R1 sd R5 (R5= Sgt puas). FREE",2017-11-15 11:38:00
"ham","Sisa kuota Kuota Utama : 2.0 GB, Kuota Malam: 4.8 GB, Kuota Aplikasi: 1.2 GB. Beli Extra Kuota/upgrade Fredoom Combo di *123#  atau http://im3.do/mc",2017-11-14 19:50:00
"spam","Kuota BONUS 4G Kamu habis. Terus nikmati internetan di jaringan Indosat Ooredoo  dengan kuota lainnya.Cek Kuota *123# atau http://im3.do/mc",2017-11-14 19:28:00
"spam","Sisa kuota bonus 4G kamu 9 MB. Terus nikmati internetan di jaringan Indosat Ooredoo. Cek Kuota *123# atau http://im3.do/mc",2017-11-14 19:10:00
"ham","sy sdh d loby mks",2017-11-14 12:48:00
"ham","ok sy k lokasi",2017-11-14 12:43:00
"ham","Saya sudah didepan tower a ya",2017-11-14 08:58:00
"spam","Selamat pagi, posisi dimananya ya? Gojek",2017-11-14 08:53:00
"spam","Sisa kuota bonus 4G kamu 39 MB. Terus nikmati internetan di jaringan Indosat Ooredoo. Cek Kuota *123# atau http://im3.do/mc",2017-11-14 00:50:00
"spam","Sisa kuota bonus 4G kamu 47 MB. Terus nikmati internetan di jaringan Indosat Ooredoo. Cek Kuota *123# atau http://im3.do/mc",2017-11-13 21:43:00
"spam","tcare PAI12",2017-11-13 17:35:00
"spam","Dapatkan cashback s.d Rp50rb di Pepper Lunch, 
 Bakerzin,Raffel's Sandwich atau cashback s.d Rp100rb di 
 Inul Vizta jika bayar pakai PayPro.Info @indosa",2017-11-13 17:30:00
"ham","Oke",2017-11-13 09:42:00
"ham","Gojek mau jemput",2017-11-13 09:41:00
"spam","Sisa kuota bonus 4G kamu 65 MB. Terus nikmati internetan di jaringan Indosat Ooredoo. Cek Kuota *123# atau http://im3.do/mc",2017-11-13 00:49:00
"spam","Kamu berada di jaringan 4G, trs internetan dgn Kuota4G. Nikmati akses APPS & YouTube SEPUASNYA, BONUS KUOTA, serta Data Rollover dgn Freedom Combo. Info *123#",2017-11-12 07:03:00
"spam","Untuk internetan lebih nyaman, gunakan jaringan4G IndosatOoredoo. Akses APPS & YouTube SEPUASNYA, BONUS KUOTA, serta DataRollover dgn Freedom Combo. Info *123#",2017-11-12 02:25:00
"spam","Sisa kuota bonus 4G kamu 93 MB. Terus nikmati internetan di jaringan Indosat Ooredoo. Cek Kuota *123# atau http://im3.do/mc",2017-11-12 00:03:00
"spam","Sisa kuota bonus 4G kamu 98 MB. Terus nikmati internetan di jaringan Indosat Ooredoo. Cek Kuota *123# atau http://im3.do/mc",2017-11-11 12:38:00
"spam","Sisa kuota bonus 4G kamu 265 MB. Terus nikmati internetan di jaringan Indosat Ooredoo. Cek Kuota *123# atau http://im3.do/mc",2017-11-11 00:17:00
"ham","Transaksi mudah dengan Go Mobile! Yuk login & dapatkan bonus pulsa 25 ribu! Ikuti langkah mudahnya branchlessbanking.cimbniaga.co.id/satu-perangkat S&K:14041",2017-11-10 20:04:00
"spam","Kamu tetap bisa menikmati BONUS Nelpon & SMS Sepuasnya dgn tarif terjangkau disaat pulsa di bawah ketentuan pulsa minimum. Info:http://im3.do/dV CPI2",2017-11-10 13:52:00
"spam","Pelanggan 085722688068, Kamu dapat 1 Pesan Chat + Raih BONUS PULSA. Hubungi *606*8# untuk baca. Pesan akan dihapus dlm 5 menit. Silakan hub *606*8# skrg",2017-11-09 16:34:00
"ham","Sekarang sudah di ariobimo",2017-11-07 21:04:00
"ham","Bpk jln dari gas station ke ariobimo",2017-11-07 21:04:00
"spam","Hanya di aplikasi myIM3 Pkt Kuota Aplikasi mulai dr Rp1.500.Pilih aplikasi yg sering kamu gunakan & rasakan hematnya.Ayo download di http://bit.ly/myim3apq",2017-11-06 11:27:00
"ham","Transaksi mudah dgn Go Mobile di tanganmu! Update sekarang di AppStore/GooglePlay. CIMB Niaga tdk prnh meminta user ID/passcode/PIN dgn alasan apapun.Info 14041",2017-11-06 10:30:00
"ham","Saya sudahdi depan lobby",2017-11-06 08:50:00
"spam","Ayo dengarkan lagu Despacito dari Justin Bieber di Spotify Premium. Daftar dan berlangganan dengan pulsa IM3 Ooredoo, klik bit.ly/spot1a SPI2",2017-11-05 16:32:00
"spam","iRing keren cuman buat km, Rizki Ridho DAcademy-Terlanjur Sakit (DM17),Rp.0,1/3hr prpnjngan Rp.3190 dengan hnya bls YA lho!",2017-11-05 13:25:00
"spam","Paket internet 1 GB, Rp 5rb, berlaku 1 hari. Kirim D1 ke 929 sd 07/11/17.",2017-11-05 12:52:00
"spam","iRing keren cuman buat km, Cita Citata-Bahagia itu sederhana (CER17),Rp.0,1/3hr prpnjngan Rp.3190 dengan hnya bls YA lho!",2017-11-04 13:49:00
"spam","Selamat, kamu dpt saldo PayPro Rp10rb. Download & registrasi di http://bit.ly/2yBmkJp. Gunakan saldo PayPro kamu utk beli pulsa. Info: http://im3.do/PayPro PAI8",2017-11-03 15:00:00
"ham","U/peningkatan layanan, Go Mobile&Rek Ponsel tidak dapat diakses 4Nov'17 20:00 s/d 5Nov'17 13:00WIB. CIMB Niaga tdk pernah meminta User ID/Passcode/PIN.Info14041",2017-11-02 16:52:00
"spam","Pemerintah mewajibkan registrasi ulang kartu prabayar sesuai KTP elektronik atau Kartu Keluarga. Ketik: ULANG#NIK#nomorKK# SMS ke 4444 Info: Info: im3.do/ulang",2017-11-02 14:11:00
"spam","Pelanggan 085722688068, Kamu dapat 1 Pesan Chat. Hubungi *858*38# untuk baca. Pesan akan dihapus dlm 5 menit. Silakan hub *858*38# skrg",2017-11-02 11:16:00
"spam","Ayo isi saldo PayPro kamu sekarang dari ATM & dapatkan cashback biaya admin Rp6.500. Nikmati diskon hingga Rp25rb di McDonald's. Info: http://im3.do/PayPro PAI3",2017-11-01 20:23:00
"ham","Dimana de? Udh selesai?",2017-11-01 14:37:00
"spam","awas ketinggalan iRing Shah Rukh Khan-Bole Chudiyan (SRK), Rp.0,1 lho.Lngsung bls YA aja ya!",2017-11-01 14:06:00
"ham","De, sekarang dimana nih?",2017-11-01 13:20:00
"ham","Udah nyampe de?",2017-11-01 10:22:00
"ham","Sisa kuota Kuota Utama : 2.0 GB, Kuota Bonus 4G : 3.0 GB, Kuota Malam: 5.0 GB, Kuota Aplikasi: 2.0 GB. Beli Extra Kuota/upgrade Fredoom Combo di *123#",2017-11-01 10:03:00
"ham","Nikmati BONUS KUOTA s.d. 10GB di semua jaringan, Aplikasi Tanpa Kuota, dan Data Rollover dari Freedom Combo. Info *123# atau http://im3.do/mc",2017-11-01 10:01:00
"ham","Khusus buat kamu pelanggan IM3Ooredoo, nikmati nonton ribuan film melalui IFLIX,TANPA BIAYA BERLANGGANAN. Download di http://im3.do/iflix & lgs nikmat",2017-11-01 10:01:00
"ham","SELAMAT! Paket Freedom M Rp 59rb/30hr aktif s.d. 01/12/2017 10:00. Nikmati akses APPS & YouTube SEPUASNYA serta DATA ROLLOVER. Cek kuota di: http://im",2017-11-01 10:01:00
"ham","Registrasi paket Anda sedang diproses. Pastikan settingan APN : indosatgprs. User, passwd & proxy dikosongkan. Restart HP Anda setelah registrasi berh",2017-11-01 10:01:00
"ham","Jl. Gunung Sahari Raya No.7",2017-11-01 09:57:00
"ham","Rukan Gunung Sahari Niaga",2017-11-01 09:57:00
"spam","Paket internet 1 GB, Rp 5rb, berlaku 1 hari. Kirim D1 ke 929 sd 03/11/17.",2017-11-01 09:56:00
"ham","Lah. Baru dapet. Yasud lah dicancel. Kirain udah nyampe",2017-11-01 09:55:00
"ham","Jl gunung sahari raya doang ada. Kumasukin no.7 di-note nya ntar blg aja ke gojeknya",2017-11-01 09:54:00
"ham","Kompleks gunung sahari permai ada",2017-11-01 09:50:00
"ham","Komplen lah ntar, tulis surat cinta yg panjang.
Btw ini kok ga ketemu sih kompleksnya",2017-11-01 09:49:00
"ham","Hmmm? Whats wrong with ur indosat sih. Bentar w isi gopay dulu",2017-11-01 09:43:00
"ham","Maaf, Anda tidak diperkenankan untuk mengikuti paket ini. Info detail www.indosatooredoo.com atau hub : 185",2017-11-01 09:41:00
"ham","Maaf, pulsa kamu tdk mencukupi. Isi pulsa & aktifkan FreedomCombo utk nikmati BONUS KUOTA s.d 10GB di semua jaringan.Info *123# atau http://im3.do/NV",2017-11-01 09:38:00
"ham","Maaf, pulsa kamu tdk mencukupi. Isi pulsa & aktifkan FreedomCombo utk nikmati BONUS KUOTA s.d 10GB di semua jaringan.Info *123# atau http://im3.do/NV",2017-11-01 09:38:00
"ham","Maaf, keyword yang Anda masukan salah. Untuk informasi lebih lanjut tekan *123# lalu OK/YES atau hub : 185",2017-11-01 09:32:00
"ham","Kamu belum trdaftar di Pkt Internet. Utk mnghindari tarif internet perKB, Aktifkan FREEDOMCOMBO! BONUS 4G, STREAM ON,UNLIMITED Nelp&SMS di *123# atau ",2017-11-01 09:29:00
"ham","Maaf, Keyword Salah. Pkt Lengkap Terbaik,DATA ROLLOVER, BONUS4G, STREAM ON, UNLIMITED Nelp&SMS dng FREEDOM COMBO. Info/beli paket,Tekan*123#  atau im3.do/mc",2017-11-01 09:29:00
"ham","Maaf, Keyword Salah. Pkt Lengkap Terbaik,DATA ROLLOVER, BONUS4G, STREAM ON, UNLIMITED Nelp&SMS dng FREEDOM COMBO. Info/beli paket,Tekan*123#  atau im3.do/mc",2017-11-01 09:29:00
"ham","Maaf, pulsa kamu tdk mencukupi. Isi pulsa & aktifkan FreedomCombo utk nikmati BONUS KUOTA s.d 10GB di semua jaringan.Info *123# atau http://im3.do/NV",2017-11-01 09:27:00
"ham","Kamu belum trdaftar di Pkt Internet. Utk mnghindari tarif internet perKB, Aktifkan FREEDOMCOMBO! BONUS 4G, STREAM ON,UNLIMITED Nelp&SMS di *123# atau ",2017-11-01 09:21:00
"ham","Ini adalah kode verifikasi untuk memasang PIN GO-PAY Anda. Waspada penipuan: JANGAN pernah berikan kode ini pada SIAPAPUN. Kode Anda 685541.",2017-11-01 09:21:00
"ham","Ibu isi gopay 300rb sama transfer ke rek 1jt ya",2017-11-01 09:16:00
"ham","Ibu lgs isi gopay aja ya",2017-11-01 09:13:00
"ham","Ok ibubtransfer",2017-11-01 09:10:00
"ham","Atau emang perlu ibu transfer ke rek cimbniaga ?",2017-11-01 09:09:00
"ham","Atau sdh ngga dgn bpk ?",2017-11-01 09:07:00
"ham","Ok, atm bca ibubdi bpk",2017-11-01 09:06:00
"ham","Dede nanti jln kaki aja kan ke basement energy, trus nanti langsung ke halte busway. Berangkat jam 9:30 an lah",2017-11-01 08:49:00
"ham","Ok. Bpk di kantin basement gedung energy, yg ada mushola itu lho. Belakang ktr ibu",2017-11-01 08:44:00
"ham","Ya udh ibu turun",2017-10-31 17:24:00
"ham","Bpk mau jemput, bpk lagi di blok m",2017-10-31 17:24:00
"ham","Mau magrib dulu nga ?",2017-10-31 17:22:00
"ham","Bentar lagi turun",2017-10-31 17:17:00
"ham","Ibu msh diatas sih",2017-10-31 17:17:00
"ham","Mau ke fitness ?",2017-10-31 17:17:00
"ham","Ok",2017-10-31 17:15:00
"ham","+62 812 93907360
B4164TKG",2017-10-31 16:44:00
"ham","08123907360
Sukamto
Katanya doi di SPBU di pintu masuk mesjid",2017-10-31 16:42:00
"ham","Eh gajadi direject",2017-10-31 16:37:00
"ham","Dudi Setiawan
081318363892
B3170SZY",2017-10-31 16:36:00
"ham","Gw peseninnya dari ariobimo sentral aja ya ntar lo telepon gojeknya",2017-10-31 16:32:00
"ham","Cukup ga tuh",2017-10-31 16:24:00
"spam","'GRATIS YouTube & Instagram selama 3 hari hanya di aplikasi myIM3. Download aplikasinya sekarang di http://bit.ly/myim3arn",2017-10-31 16:24:00
"spam","Isi Voucher Regular 25K pd 31/10/17 16:24 dr GO-JEK SUKSES. TID:01034700003349071897",2017-10-31 16:24:00
"spam","iRing keren cuman buat km, Cita Citata-Perawan atau janda (CER17),Rp.0,1 dengan hnya bls YA lho!",2017-10-31 13:26:00
"spam","Kini kamu bisa mengatur & mengontrol penggunaan Kuota Aplikasi dgn myIM3. Ayo download aplikasi myIM3 di http://bit.ly/myim3ctl & gunakan fitur Hemat Data",2017-10-31 09:51:00
"spam","iRing keren cuman buat km, Repvblik-Sayang Sampai Mati (vl17),Rp.0,1 dengan hnya bls YA lho!",2017-10-30 13:51:00
"spam","Pulsamu <Rp500.Mau PULSA SOS 10000 bs dipakai ke SemuaOperator sd 5hr?Pembayaran Rp10000 & BeaJasa Rp3000 akan dipotong saat isi Pulsa.Balas YA ke 505 /tkn*505#",2017-10-30 12:04:00
"spam","Kamu internetan dg tarif perKB, pemakaian sampai saat ini 12600. Ayo beli FreedomCombo,Nikmati BONUS KUOTA sd 10GB dismua jaringan & DATAROLLOVER. Info*123#",2017-10-30 12:03:00
"ham","Uber: Anda mendapatkan potongan Rp 5000. untuk 10 perjalanan uberMOTOR Anda. Ayo pesan Uber-mu sekarang! http://t.uber.com/nguber",2017-10-30 12:00:00
"spam","Paket internet 1 GB, Rp 5rb, berlaku 1 hari. Kirim D1 ke 929 sd 01/11/17.",2017-10-30 06:15:00
"ham","Kays",2017-10-29 23:38:00
"ham","Gojek:
Hanif
B3075SPI
+62 896 03370485
Katanya tunggu di dalem aja nanti dia masuk (?)",2017-10-29 22:47:00
"ham","Maaf Pulsa Anda tdk mencukupi atau sdg dlm masa tenggang. Isi pulsa dan daftar Freedom Combo paket internet terbaik di *123# atau im3.do/NV",2017-10-29 22:46:00
"ham","Skrg km brp?",2017-10-29 22:21:00
"ham","Kursi no brp?",2017-10-29 21:07:00
"ham","Ok",2017-10-29 21:06:00
"ham","Lancar ngga ?",2017-10-29 20:38:00
"ham","Sdh sampai mana?",2017-10-29 20:38:00
"ham","Baiklah ti, kl kamu yg nyuruh, aku harus cepat sih kalau begitu 8)",2017-10-29 18:51:00
"ham","Hahah gausah terlalu dipikirin ti yg kyk gt2, aku ga sedih tp bakal kangen ti hari2 kamu disini. Hati2 yah sa, eh ti, dijalan :3",2017-10-29 18:39:00
"ham","Ya udah",2017-10-29 11:24:00
"ham","Ya ",2017-10-29 10:45:00
"ham","Berapa de de ?",2017-10-29 10:40:00
